id,text
48108329,problem with send data hl-seven server use node just trying make simple hl-seven mllp client using node make some code that create connection with hl-seven server via socket send some data server then wait for some answer for test purpos use hapi testpanel issue when send data use script hapi testpanel testpanel don anwser the testpanel log says that client connect and than nothing when turne debug option testpanel log says that testpanel recieved bytes from client end then nothing else what the wrong with script can anyone help thank you here script here screenshot testpanel log
39133855,smart fhir python client with bundle have fhir patient bundle json from the everything operation now interested using the smart fhir python client model make working with the json file lot easier example give the following would possible instantiate something with just generic bundle object class able access different resource inside the bundle
19869939,hl-seven accelerator error schema find after upgrade biztalk dev machine upgrade biztalk server biztalk send hl72 messaves from another machine this one and get schema find error alternate error number alternate error description schema found alternate encoding system hl-seven bta the message specify lab the sending application and have party calle lab which specify the schema namespace figure why look for the oru schema the default microsoft namespace our message looks follow anyone have ideas try
38400543,invok mirth connect cli with powershell script use powershell invoke the mccommand exe explicitly avoiding use the parameter the mirth cli pass mirth script file because want pass dynamic command instead the mirth shell when invoke mccommand exe from interactive powershell console able connect the mirth connect server and the opened where run one more mirth shell commands manage mirth channels example when run the same command from within powershell script via the windows powershell ise get the same connected mirth connect server message but the script wait and get the command prompt that allows pass mirth shell command mirth any thought how route commands the mirth shell via powershell script
50110904,use sparql get the first entity superclasses certain class use jena from java code and blazegraph server try query the first superclass path certain class and course didn use either with the predicate the query work well from the blazegraph interface but when try apply the query from jena and java return all superclasses the following being the query and the code note this when use the web interface blazegraph with url localhost the query work well but put the address instead localhost the query return all superclass but from java code neither change using localhost edit what follow the property file
39238369,cda fhir mapping trying add support for ehr platforms take pure implementer approach build intermediate representation such xml for map cda fhir use the smart fhir the reference implementation for this the cda trying use the australian extension ereferral digitalhealth gov implementation resources clinical documents nehta possible create such intermediate representation use the smart fhir any other fhir reference implementation have anyone else try this while search for actual implementation come across these repos the fhir group have some hand crafted are there any equivalent cda examples for these fhir resources read couple web articles and white paper documents regard the challenge between the transform such david hay say fhir document that like object graph roote the composition resource their equivalent representation for cda rene spronk about whether hl-seven message document what being the implication for implementer who has handle and validate representation across both cda and fhir when fhir accommodate the full cda use case the future hold the promise seamless integration and information shar between clinical document and apis this mean that cda fhir transform not possible this stage the fhir standard apology for cross posting both and fhir community forums
40586787,why isn fhir resource validate against profile trying validate instance the resource type basic against the following profile which created uploade the profile local hapi server then try upload resource and validate using the following url url basic validate profile url structuredefinition stelar profile questionresponse this the resource when upload happy get number error code returne with the message unexpected failure while validate resource not really sure how find why fail though how about this can anyone spot what the issue with form
1008897,emr electronic medical record standard record format few associate and myself start emr project electronic medical record heard talk the past and more lately about standard record format facilitate the transferring record when appropriate hipaa from one facility another have anyone see any information this
21085706,fetch data from cerner emr ehr don have much idea medical domain evaluate requirement from our client who use cerner emr system per the requirement need expose the cerner emr fetch some emr ehr data and display sharepoint portal meet this requirement what kind integration options cerner propose there any api web services expose which used build custom solutions for the same far know cerner expose emr ehr information hl-seven format but don have any idea how access that request cerner for the same awaiting reply from their end anybody who associate with similar kind job can through some light and provide with some insight
40520486,how generate event after hapi rest api call execution analyze the implementation hapi method fhir enable legacy information system need execute some other task after rest api call consumed hapi for notify third party execute sql have you have similar experience how have you tackled requests thanks lot nicolas
30405438,message response zombies occurr with errors code and orchestration consider the following message flow biztalk mllp receive ports locations setup receiv hl-seven-v2 message one application these port each receive slightly different message type let call this one rp1 another application send port that subscribe each respective receive port these send port each have outbound map that transform the messages hl-seven-v3 and submit wcf request response service let call this sp1 the wcf service then process and validates the hl-seven-v3 and send hl-seven-v3 ack message the sp1 send port have custom send and receive pipeline components the receive from the wcf response just take the message and promote certain field which use later for subscription there being then two more send ports sp2 that subscribe positive acks sp3 the negative base the field promote above the positive acks are consume and the negative acks being emailed off support staff the issue that about messages see these error messages popping followed suspend service instance the group viewer the service name the suspended instance that rp1 the message type the non consumed message that the ack from sp1 the wcf response this weird because mind rp1 should expect this response message and there being send ports sp2 sp3 subscribed the response message type the other point forgot make there being receive port like rp1 each with receive location and send port subscribe their respective receive ports the biztalk server install across physical server shar biztalkmgmtdb messagebox previous this have the same number messages feed but was consolidate the sending end one single receive location the old solution have multiple orchestration but experience this issue why now being the wcf hl-seven-v3 response messages getting lost and being suspend under instance rp1 hl-seven-v2 here basic image what look like
50707499,standard code identify email types work personal etc work for health technology company and use the hl-seven and snomed standard code identify phone numbers home address races ethnicities etc look avail for hl-seven snomed standardized codes define user email type there another standard with code that identify types email
234909,sql for pars edi ncpdp hl-seven have some edi message hl-seven etc store oracle database sometimes want pull individual fields isa currently have some really ugly sql like create sql package make easier and wonder anybody have already done this imagine something like select edi extract field clob column isa from edi table
41110920,what mean fhir compliant work solution for the hrrp want make server fhir compliant but what fhir compliant mean hrrp solution have some data that match any the pre define resource for example the hrrp solution involves calculating scores like readmission ratio payment etc
651404,firebug breakpoint doesn hit setting breakpoint external file and haven able get firebug hit the breakpoint consistent way work sometimes but most the times doesn the only get work switching break all error use the debugger statement well without any luck
50703429,how load test hkclinicalrecord data into healthkit yesterday apple announce their the state that want some prototyp and don work for one the hospitals clinics apple currently support how load data into healthkit test reading and use this data app
21434426,customize hl-seven adt message with biztalk btahl7 accelerator very new dealing with hl-seven and company recently begin very large project which receiv various adt message the hl-seven specification already use biztalk extensively here and the plan leverage the btahl7 accelerator for biztalk accept these message issue this the adt messages receiv from our trading partner match the hl-seven specifications for pretty much all the message receiv even though the msh segment for and they tell that the version they sending files instance they send message and the pv1 field the spec call for subcomponent separate the standard delimiter what they send that field subcomponents example f11 instead this which match the spec this also happen for the pv1 field after scoure the internet find any help for deal with this kind situation biztalk use the accelerator seem that people customize the data within the message and that happen often for instance send string where the spec call for int but change the actual layout the situation list above when deal with hl-seven and biztalk these message fail even when don set biztalk validate body segments custom data types which makes sense and expected because they aren send strange data that still conform the layout the specs but rather entirely different layout question this there way deal with this utilize the accelerator functionality without having write custom code fix the file before send them the accelerator pipelines accord our trading partner this just the way their product cloverleaf send the data and that they work with various other trading partner with this format
3308194,what the hl-seven zds segment use for very old hl-seven parser has hit snag now get some message with zds segment present easy fix zds object parser but trying find what use for google hasn helpe much this sample interest what each field though look this sample data seem don lose much just drop the whole segment
947078,mirth inbound message template that not the same the channel source type the problem that the inbound message template expecting different type than want specify work with the requirement have single channel convert hl-seven call web service then convert the soap result xml and convert that hl-seven and send the original caller this must done asynchronously setup consider the situation mirth channel source llp listener type hl-seven the sender the hcis health care information system source transformer not relevant problem hand destinations order javascript writer call into code template some database work soap sender call web service which return hl-seven javascript writer contain handful transformers writer call into code template the problem lie here javascript writer again call into code template the postprocessor generate custom acknowledgement send the hcis problem the inbound message template expects hl-seven because inherits the datatype from the source need map hl-seven template outbound message template the outbound template work fine bind anything have tested this setup another channel with hl-seven the incoming datatype and works question how force mirth recognize inbound message template hl-seven instead inherite the channel incom data type
1050644,convert xml plain text goal build engine that take the latest hl-seven cda documents and make them backward compatible with hl-seven which radically different beast the cda document xml file which when paire with its matching xsl file renders html document fit for display the end user hl-seven need get the rendered text devoid any markup and fold into text stream similar that write out character lines populate the hl-seven message far taking approach using xslcompiledtransform transform xml document use xslt and product resultant html document next step take that document perhaps step before this and render the html text search for while but figure how accomplish this hope its something easy that just overlooking just find the magical search term can anyone offer some help fwiw read the other question which embrace admonish using regex for this and don think that want down that road need the rendered text
30064437,neo4j cypher unidirectional query when there being bidirectional relationships don think possible what seek but think throw out for creative suggestions the unified medical language system umls semantic ontology which have variety bidirectional relationship between node for example isa and inverse isa the problem there being many such name and their reverse direct relationship thus query enough exclude one because the listing have many possibility which cumbersome and may overlook something the problem other word can you create directed acyclic graph query when there being relationship that reverse the traversal you have outbound relationship from node you want ignore the inbound relationship from use neo4j the umls filter the data have 11m node and 45m relationship there being relationship types and the list dynamically grow this another reason for generic solution not dependent specific listing and out bind relationship
49134431,hl-seven assigne patient location generate hl-seven file but face problem with pv1 segment don find how set facility variable with value use hapi but don find their java method that allow that succed for set pv1 consult doctor field but there insertxxx method for set pv1 field just one get the value
29871239,how install and use openehr libraries with maven need use these library with netbean and the installation guide tells meet the java requirements and netbean bundle maven but find install and use the libraries java project can someone help
2435563,mirth transformer error prefix for element bound getting the following error when trying convert hl-seven-v3 hl-seven-v2 the message pass the error get when remove the tag front the envelope and body and redefine the namespace default give new error this referr mirth handle the namespace being define the same line the first use that element any suggestion would useful
49847180,sas proc freq combinations automatically have patient dataset that look like the below table and see which diseas run together and ultimately make heatmap use proc freq make this list table but too laborious through like this because give every combination thousands would ultimately like bunch cross tab show below see how many patient have each combination obviously possible copy paste each variable like this manually but there any way see this quickly automate this thank
11697457,how prevent website from being hit boosted making social site where user post content and the content view whenever user from different address view the content the view count incremented multiple request com from the same address count however lately someone iterate though list proxies something and artificially increas the view count how prevent this there something check headers something thank
9942378,mirth process multiple segments here some map for next kin then process this have the javascript below the reason that try this time get multiple next kin segments come through that the case mirth throws error details typeerror assignment list with more than one item support but unfortunately script doesn work doesn throw any error but doesn what suppose for multiple segment work for single segment this outbound message
432975,identify unique hit with javascript can you suggest efficient way identify unique user with javascript calculate hash send the server side edit the point that intrude into the browser send cooky and ips being the option and have client side solution therefore javascript
50918982,medication order prescription openehr new openehr wanting understand how medication orders are related imagine that would useful understand that medication orders are relate and issue part the same prescription from analytics perspective think triple drug therapies however look though the openehr standard permit this relationship the form prescription composition and prescription template mostly for the purpose communicate this set medication orders the pharmacy rather than for analytics someone able help understand the relationship between the medication order and prescription please cheer
2642082,how extend wpf hit testing zone for path object wpf hit testing pretty good but the only method found extend the hit zone put transparent padding area around your object find any method add transparent area arround path object the path very thin and enable hit testing the user clicks near the path find any method extend the path object with transparent area like the image below tried use partially transparent stroke brush but run the problem describe here also tried put adorner over line but because wpf anti aliase algorithms the position way off when zoom canvas and interfere with other object hit testing bad way any suggestion extend the hit test zone appreciated thanks kumar
10764489,how import hl-seven for blood result and parse for patient report develop medical application use and asp net wherein need make module for patient blood result that module need import hl-seven message and then parse them get patient blood result and highlight normal value for that blood test have some dll from nhapi but know how use them can someone advise how start this module actual requirement being bloodresult ultimately this will import from hl-seven initially cut and paste results being parsed and processed show current result and highlight trend and abnormal value store results table
2435228,need help hl-seven need all your help guide with work hl-seven interface integration which work between two disperate clinical applications its something like this let explain query with example have epic system that place orders lab medications etc presently now next these lab orders being result another cerner application for this there have interface engine which has read the hl-seven messages com from the epic system and translate them proper message for the cerner system and then write into their database can you please explain with example interface engine which read the hl-seven message first and translate them cerner application format how implement interface engine here which read the epic data what steps are involve example would best mainly orders are first placed epic and resulte cerner applications please help with understand the process and how interface intregation with interface engine
30208002,hl-seven servers and hl-seven listener develop web service that suppose get hl-seven file from client and parse into xml then push data into database now question what need focus for this requirement hear that usually emr system send hl-seven file through tcp how hl-seven server work need create hl-seven listener this hipaa compliance that hl-seven push server through tcp can any explain all
20477658,mezzanine django hit counter for blog posts look for something that count and publicly display read hits mezzanine blog posts com from drupal where this functionality built found and look like they can both the counting part but neither appears been maintain for some time just need make the app work with recent mezzanine django and add the public viewing part perhaps using template tag stackoverflow have public view counter
662639,hl-seven pars php look option for pars hl-seven message via php aware the net hl-seven package pear but perfectly honest don think that want base code around seemingly abandone package and even just don think that brain suit the function correctly hl-seven background make bit more sense don know guessing that the time going pars and read data from message the other creating and sending messages don necessarily need any form validation the messages themselves just need pull push data definitely need support for non xml hl-seven but naturally xml base and would bonus anyone have any suggestion other library that use looking for pure php solutions want have minimal requirements the server that aren copy this directory here thank
10107569,hl-seven version parsing pars hl-seven version message through hapi now want parse hl-seven version message which being xml format hapi support hl-seven version how can this
20347654,mixed content jaxb generated files consider the following type definition xsd find that jaxb has hard time generate code for element tried using but that isn supported very well and generate awkward code thought modify some element through custom binding want all element which specify have custom field which hold the cdata between the tag for instance for type can like this xml the title element use its type yield its content how this for those you interested trying generate code for the hl-seven-v3 cda specifications
20018354,what nfc tag use for scriptalk talk pill bottles several pharmacy chains area begun offer nfc tagged prescriptions customers that read prescription labels due visual impairments dyslexia other reason being impair technical and volunteer time implement assistive technologies know these tag read acquired galaxy there few nfc compatability issue with the and with recent android upgrade curious phone would able detect and read the nfc tags use scriptalk this indicate how likely smartphone read these tag see lot use with nfc tags use for assistive tech and use phone universal nfc reader would awesome have nfc experience hoping someone shed some light this thank you
11436102,disappear cookie mvc4 after creation httpmodule create module handle authentication microsoft healthvault the beginrequest event handler check for the authtoken and when received creating new cookie hold the user information for use later the controller lose the cookie but maybe look the wrong place the event handler take httpapplication the only parameter add the cookie application response cookies collection the question come down this instance httpapplication singleton the same system web httpcontext current applicationinstance perhaps though cooky set this point the lifecycle being later wipe that what wrong any help appreciated update changed few thing since pose the question now handle prerequesteventhandler httpmodule let healthvault webapplicationutilities object the cookie creation and storage though conceptually nothing changed having any trouble creat the cookie read the first time after create here cookie creation code the httpmodule event handler notice that the redirect comment the first request after auth the cookie create and default action able then read using loadpersoninfofromcookie find that the redirect cause the cookie send the client notice that the subsequent requests the cookie present the request cookies collection when loadpersoninfofromcookie runs end with null strangely see the cookie the response object but the content being empty here the action code just because update here the cookie from the immediate window even bumped the expires time days the default action right after create the action the next request interestingly the cookie define the response object but the value gone and the expires time reset
3306468,medical imaging separate programming specialty sorry yet another question with response feel free close there bunch questions doe technology language database use medicine quite different from that use traditional area like banking industry etc you hear response difference vague and hard according lack standard but medical imaging attractive not only due general concern humanistic scientific job opportunities being strict and obvious activex some open source libraries dicom hl-seven python look like separate specialty you don need explain interview what exactly you question medical imaging separate specialty seem stranger the vendor mostly the same direction and you change them without change world view happens enterprise just kind programming which usually interchange with some other image processing trade drivers system programm etc
19922858,mirth send file like pdf zip transfer pdf files use mirth want transfer pdf zip file through mirh using file reader connector source and file writer destination connector can any one help how send transfer pdf zip file
