id,text
6182611,and determine if 86 or 458 is within that numeric range xsl take range value like and determine within that numeric range pars xml file like xls stylesheet need display value indicating whether the value within the normalrange below above this very common problem when display human readable result from the ccr continuity care record healthcare hl-seven message xml document
5980423,hipaa compliancy what need know would for brand company and just scratch the surface collect pharma data know bit about hipaa com pliancy but guess where fuzzy when collect data via form need identify the data store across separate tables etc who what have access the functions procedures unencrypt any data stored can the database mysql database need certification approval license any this basically what need besides encrypt the data and store hipaa compliant server want capture customer data via form thanks
6444602,how tell the mouse pointer inside path define bezier curve and lines close path consist multiple bezier curve and straight line segment how tell whether the current position mouse pointer inside outside the path example mouse leav the area example mouse enter the area
24374847,xtk display label map slightly change demo load image instead the demo load mri image just fine see also works load label map the main volume however add the label map volume the loading fail and the volume shows see the only error the console the following any idea what might wrong how suppose debug such error
13723892,misra equivalent for medical industry pretty much the title there medical industry equivalent document standard set either the auto industry misra work the area but anything language agnostic would good too
40770183,fhir medication administration current dose need saying where being currently within dose medication like execution out dose administration number anyone know how express this the event object elsewhere
40701191,mongodb for hl-seven fhir learn fhir and trying implement with mean stack which use mongodb database seek your help question when get the post request for new resource docment insert into mongodb since the mongodb add the object the resources unique when retrieve the document have the extra field think make the resource compliance any more since the define the resource know how handle this issue will this extra matter the fhir resource best regards autorun
24528536,request patient demographics from his via hl-seven work application that connect with his via the hl-seven protocol the connection for synce the patient demographics save application with the his how you request patient information some patient their anytime the documents talk about update trigger the patient demographics change his send the new data there way request the data anytime
33303231,resource specializations the fhir schema define very generic resource that represent concepts implementation and the meaning the resource difficult impossible determine from the object itself for example the condition resource represent problem problem list admission diagnosis final diagnosis primary diagnosis etc the meaning the condition depends know which these there way make this explicit fhir some cases profile structuredefinition used distinguish between specializations resource but this doesn work for thing like final admit diagnosis since these contain the same data there discriminator and not general solution
6037745,please explain the cda entryrelationship element have access the hl-seven clinical document architecture release which state that used link entry with each other cda document specifically link between what calle the source and the target entry also read about the different types relationships caus comp gevl mfst refr rson sas sprt subj xcrpt and somewhat understand those main question what being the source and target element being they the element contain the and the element contain example the above snippet according understand there subj relationship between the the the first and there refr relationship between the two this correct
22506180,difference between hl-seven ver and googled this title but unable find any comprehensive information chiefly interest new segment that been introduce version
24328971,how query xml column tsql hl-seven message have hl-seven message xml mode like this obviusly hide some part need retrieve tsql table like this tried with this where variable xmldata the xml above but this doesn work anyone help thanks
7313963,port java server android working develop medical records system use openmr backend for android openmr dependent some seriously heavyweight library including hibernate and spring dexing the entire openmrs application generates file that too big even for the android classes dex file format this size limit well documented get this currently working creat multiple dex file from the dependency and loade them during runtime use android dex classloader because the way the mobile version the server use practice the actual processing demands will very low despite the huge dependency trying run enterprise server phone here before spend week more time try engineer this just wanted ask the developer community this strategy just pipe dream load all these library will the entire binary get loade into ram and just break the system there good way optimize such application there some obvious problem solution miss here
20327053,convert hl-seven message fhir resource directly some poc around convert hl-seven message fhir resource first step convert the hl-seven message into xml format use xmlparser from hapi api and second step write xslt convert this xml into fhir resource xml format just wanted figure whether there any simpler approach this hl-seven fhir resource conversion one step process rather than the two step that just speak about
31124860,how represent the patient room number fhir resource look the fhir documentation for patient resource find specify patient room number pertains organization facility that they associated found the location resource type but don see how associate that with patient thought
2103147,hapi chokes hl-seven segments trying use parse hl-seven messages generate external system these message include custom segments includ the second segment the message between msh and evn the problem that for any segments parsed after encounter this first segment hapi generate the message structure but all data that structure null still have evn segment object but won have any data try nothing just parse the message with out the box hapi and ignore this segment extend hapi creat own adt message class extend the default classes connect the segment with addnonstandardsegment add with custom implementation abstractsegment current workaround pre parse the message before hapi get and cut this segment but this definitely the wrong approach anyone have ideas what
25261705,difference between hl-seven ver and google unable find any comprehensive information which being the new segment are adde version like validation message
15359848,how convert character encod chameleon simulator utf which default lating want simulate japanese hl-seven message over chameleon simulator but when select that message from file japanese characters being display special character into chameleon simulator want displayed japanese characters how convert character encod chameleon simulator utf which default late
4548333,mirth change default ack field value using mirth with llp listener receiv hl-seven-v2 message the customer expect ack message from and check the send ack radio button the only problem that the default ack put mirth the msh field need change this another value say where come from this possible
40000311,fhir restful adding multiple patients resource single call the title says post patient resources fhir via multiple call and have the patient passed xml have hundreds thousands patient add well tons other data just wonder there more efficient way post this
41829553,fhir custom extension add add custom extension schedule resource app schedule visit motive reasons know there list classified appointments encounter reason but use mine have something like this not sure about this part correct add extension this way there being always multiple visit motive for specific schedule list them also see this kind thing which one the correct one wrong
21835607,identify hl-seven schemas for cda the company work for recently start project delv into the world hl-seven message and data trading use biztalk server with the btahl7 accelerator for with success far for hl-seven but now need accept hl-seven cda documents these being ccd accept from external vendor have the full suite xsd schemas from hl-seven for cda all them but struggle with how figure which schema relate the message receiv all have work with being test ccd message from our trading partner and other information tried use the code and display name along with the templateid figure which subschema this match map into our internal canonical format for data loade but struggling figure that out rather create one project biztalk that hold all schemas parse and validate these file that make reading map and transformation mechanisms that much more difficult have anyone with experience hl-seven and biztalk get any guidance how identify the appropriate subschema base the information available the test file here the header information
51384447,why hl-seven fhir json resources have root element implement fhir server able receive resource both formats xml json order make simple consistent idea internally work just with xml and translate json request xml and vice versa but although work with some sample json documents work with fhir json resources the main reason that fhir json resources have root element the xml conversion tool create proper output xml fhir json observation resource like and with root element should aware not mandatory for json document have root element but most xml json converters work better that scenario and fhir accept both format why define fhir json resources with root element specially when seem that some initial dstu use that approach thanks
44009048,rxnorm snomed mapping have medication list our medical system they being mapped ids want migrate there way match rxnorm ids snomed concept ids perhaps there database with link service
3954444,where find downloadable prescription and otc drugs database work project for base online pharmacy and have hard time find database drugs grouped layman categories downloade fda data from drugs fda and facts fda contain wide list approve medication but sort grouped layman categories like you find online search libraries the information obtain for every drug benadryl same obtain enter the name here dailymed nlm nih gov lot useful information but way for categorize group into meaningful block for pharmacy client anti allergic shown here there anyway download obtain this information some kind database and avoid having categorize the almost product that downloade from the fda website appreciate any help link hint anything thank
40990635,purpose smart fhir and fhir net api can anyone describe the purpose the following tool and difference between them
25274848,fhir spark net make mongodb storage hipaa compliant look for way make the mongo storage use spark net hipaa compliant use mongodb ssl transport encrypt data wire and use gazzang for data rest good enough being there other option for data rest while still allow for index certain properties json
50998437,what all the hl-seven segment structure table headers mean for example the obr segment reference table have the following headers seq length opt rpt tbl name here being observations seq seems self explanatory the field number the segment things like etc length look fairly straightforward too the length the data but some them are look like data type things like etc name also self explanatory the full name the field here being the main things don know about what opt mean this column see thing like what rpt mean this column see thing like what tbl mean this column see thing like
12182364,exchange hl-seven message over the internet new using hl-seven currently exchange hl-seven message over tcp with standard hl-seven tcp listener sender this all work fine and doesn pose any problem but host emr create and maintain vpn our server this question this there way that bypass the vpn and exchange hl-seven message over the internet https and from our web services search and search but find any answer one way another and please nothing about hl-seven version because nobody actually seems use customer being all using hl-seven versions have for year and show inclination change
14050402,need parse hl-seven message need parse hl-seven message validate the message and then parse
43350459,how should one send acks mirth from web service want write simple web service that use mirth send hl-seven message this web service can simple cgi script and need accept the hl-seven message string and possibly couple other value post request using mirth http sender this seem simple enough but how should this web service send the ack let mirth know everything something wrong there specific format that mirth expecting response there some way tell mirth what expect note want use mirth the receiving end
13358423,mirth traverse through globalmap mirth implementation mirth connect server have globalmap that contain key and property come from external property file how get the key set from the globalmap and iterate get the value
44052028,spring boot embedde servlet container working project use mdht model drive health tools runtime api library which base eclipse model framework emf work when server spring mvc project but for some reason the emf package registry getting loade properly and therefore deserialize consol ccd document when try servers sprint boot project code sample link mdht user documentation edit after changing use external tomcat deploy instead spring boot embedde servlet container work but still resolve using embedded container
31892048,image registration two volume with different number slices try register two volumetric image from brain pet and even pet and each these volumetric image contain different numbers images slice for have slice and have slice thinking use interpolation method calculate and reduce the number slices this correct approach anyone know any resource that can helpful for like pseudo code step that should through for register two volumetric image thank you
30459950,downsample fmri image with fsl set fmri image one group have dimensionality with voxel dimension volumes the other group have dimensionality with voxel dimension use one the images reference image for registration due the difference resolution the registration fail with flirt have first downsample upsample try the following approach flirt input image ref good size image out output image applyxfm init usr share fsl etc flirtsch ident mat this work for downsample and not for upsample how should correct downsampling upsample
23525727,hl-seven segment message type segments being there any restrictions the segment that use for specific message type for create sample hl-seven adt ref message include any segment that like hl-seven have some rules defined choose the segment for specific message type the below hl-seven message correct
12936366,how validate ccd hl-seven document when have example ccd use xsd schema and conclude that have valid ccd use some other non schema base method uml model rule addition valid xml document there even such thing even only guides create valid ccd
50821378,how convert local date utc mirth mirth receive local datetime string which need convert utc soon found using the classic doesn work well this for give after some more searching found can this and from here stick don know how convert this utc local server timezone assume which enough for now but the future also need set specific non local timezone tried get the method use with but that give the helpfull also tried looking the java docs for dateutil and try some method from that but nothing worked does anybody know how convert datestring from local time utc all tip being welcome
14354794,how differentiate structured and unstructure cda work cda documents able validate the xml documents against cda schema and find the the xml cda not but cda then there are two categories cda documents structure cda human readable text unstructure cda embedde blob referenced documents what the key xml element that differentiate cda structured unstructure document
32068133,post xml json fhir api server work medical application base hl-seven fhir trying add new record use xml and json both but all get the internal server error the xml trying post posting this xml api server use php curl but get internal server error try with json too but luck here the json spent days fix this issue but couldn find any solution any help appreciated thanks
12605316,php hit counter auto generate for multi page total newbie with php and trying get this current php text hit counter script from phpjunkyard com automatically generate counter for dynamic page without having create counter txt file every page far mange get write new txt for every new page exist but get error and don know how remove use this counter because have unique visitor count system this the original full php file and this what changed line from create new counter with the txt for every different page like but this the error get when new only the first time when creat the txt file after then you open back that same show like normal sorry for bad english hope someone help thanks
21862509,generate class from fhir schemas attempting generate class from schema provide the fhir project downloade the schema unblock the zip file and unzipped the xsd file into folder while attempting use xsd exe create class keep getting error that indicate issue with the schema consistently get xhtml div element declare addition others the file fhir all xsd seems list the top level objects was able get the simple schema tombstone xsd work with xsd exe but more complex item like valueset xsd alert xsd fails see what wrong with these file any help how fix these schema appreciate
22174674,hl-seven v2x and data model the company work for start new initiative hl-seven where trade both v2x and cda specifically message the point where able accept validate and acknowledge the message receiv from our trading partner and started create data model for the backend storage said messages after lot consideration and research loss for the best way approach this sql server currently idea load the data into data warehouse directly from integration engine biztalk and foregoing backing normalized operational database set the database for v2x messages accord the spec all versions hl-seven being backward compatible store any previous version the same database initial design have table for each segment which tie header table with guid generate and storing run time the biggest issue with this approach the amount columns each table and something experience with for instance the pv1 segment have columns order accommodate all possible data addition this need make all columns varchar and make them big enough house any possible customization scenario from our vendor planning use varchar achieve this lot these columns the majority probably null use sparse columns this scream bad design but fully normalize these table require ton work both biztalk and sql server and not sure what gain from doing try pragmatic since have deadline fully normalized create stored proc that have ton parameters split these messages the nth degree individual load into the smaller subtable and make sure they all correlate back the original guid want maintain acid process which get tricky and cause lot overhead biztalk suppose 3rd option use nhapi create objects out the message tie into with entity framework but nhapi seem like dead project and experience with entity framework right now basically loss and need help from some industry professionals who experience with hl-seven data model worth the extra effort fully normalize the table performance the sql side abysmal use these denormalized segment tables with hundreds column most which null for each row dba trying understand the pitfall each approach looked rimbaa but the hl-seven rim seem like foreign language hl-seven newbie and translating messages the rim take far longer than have complete this project hope overthinking this and there simpler solution star the face hopefully this question isn too open ende
51816213,restful api requests using trying get example find from this work and method work but have some issue with and get server reply bad request with get this error httprequestworker cpp changed request type here function for get contents json file from computer and execute the whole input request for the server here the simple json want upload json file should right because able and with postman and other tool there something obvious that miss capture from postman with see that read json successful have trying find solution for with success
12721771,how generate two xml file from single hl-seven file and insert both into two different column single record have source connector type file reader which read hl-seven file and destination connector type database writer database table have two columns participant information spr information want transform single hl-seven file into two xml file one for participant information column and other for spr information column and need insert both single record into the database table able insert one xml time but not able find the way insert both the xml single record into the database table any help appreciated
33156991,how integrate any dplyr working claims data which look like the below format would like group mem number and year month and covert all those labels clinics even single label that group clinic the output approach this problem its giving errors know mistake and how resolve
33041824,select date from previous observation and input into new column work patient health records and trying find the last clinic visit from there first clinic visit below the data frame the output planning use the dplyr approach need some guidance the mutate part
3988638,revers old file format inbox trying reverse engineer old medical imaging format calle stentor for interoperability was designe company the same name who was bought phillips but phillips has forgotten how read stentor files have windows program which export jpeg from stentor file but close source like automate this process order tackle hundreds file this format the program late 1990s win32 mfc executeable run next activex ocx file which able interop with but that file doesn contain the export method look for suggestion how dissemble the binary order unearth the algorithm used convert stentor jpeg look through the stentor file hex editor and didn find any evidence jpeg although hint find that appreciated think that the program have couple trick its sleeve thank advance kyle
15064814,validate xml with schematron php have problem with validate xml with code load the xml and xsl domdocument object and try transform but the function return this error don understand technically the importstylesheet associate xsl the xml someone wants look sources files are
22658969,null reference exception when call personinfo createfromxml healthvault write fixture for the personinfo class healthvault for use unit tests taken the xml from exist personinfo and stored file know attempting use the personinfo createfromxml but cause null reference exception with indicator what cause first all this the correct way use this function and secondly what make return personinfo object
39960307,search resource with reference null maybe misunderstood something search mechanism fhir but found find some object which any value some parameter for wanted build organization tree this case know objects first level this tree and think objects with empty partof property but say nothing about maybe there another way how achieve
40363249,hapi failing return basic resource after successful upload try upload resource hapi base the resource type basic and create custom profile and extension for the concept try capture uploade those structuredefinitions the server using host local host but not yet validate this upload against still trying test that the format use for xml correct uploade the following bundle there being many more record the actual bundle just edite down for clarity which seems uploade correctly since get the response however when try access this via the url get the following response any idea what cause this issue work fine when upload patients and try pull them back but try for basic seem work
