id,text
5303623,convert xml hl-seven messages use mirth connect work with mirth connect and getting stuck one task transformation xml hl-seven connect access database the hospital system access set the channel and set the connector type file writer the destination tab when deploy the channel see the log file populated with the records xml format now stick how convert transform the xml message hl-seven any pointer out there
4680906,guide hl-seven implementation trying get handle hl-seven and far reasonably clear the data structures and encod protocol where remain mystified the actual implementation mechanics sequence request ack response ack and such thing need ack ack etc what receive nack ack etc any pointer where start looking learn about these thing
32348567,access and schedul fhir questionnaire resource trying understand how use the fhir questionnaire resource and have specific question regard this project specifically regard how citizen our country respond questionnaire via web app which are submit the fhir server questionnaireanswers read analyzed health professional fhir base system have lots questionnaires group even specific targete towards certain users groups users the display the questionnare the citizen based care plan sort example certain questionnaire needing fill the week after surgery the questionnaires can also regular one that need filled every day week permanently support data collection the state chronic disease what wonder fhir have resource which fit into organize the logistics display the right form the right person see careplan which seem partly fit this something that handle out fhir scope specific server implementations summarize which resource mechanism health professional use set that patient answer certain questionnaire either regularly part for follow after surgery this include setting the schedule for the form fill and possibly configure what happen the form wasn filled require which resource possibly the same mechanism use for the patient web app retrieve the relevant questionnaire given point time
24029234,hapi hl-seven message trying use hapi create hl-seven message and send the hl-seven message over mllp use pam profile need use hapi create the hl-seven message unable find any documentation examples for hapi where find hapi resource
41322603,mirth performance benchmark use mirth connect for message transformation from hl-seven text and store the transformed message azure sql database our current performance message per hour machine configuration ram and core cpu memory assigne mirth xms 6122mb don have any idea about what performance parameter for mirth with above configurations anyone have idea about performance benchmarks for mirth connect
22859215,hl-seven parser parse message java look for hl-seven parser that parse messages try hapi but has support upto can you anyone please provide any suggestion parsing messages
24049876,serialise fhir resource json use java api trying convert fhir object the json string find any api methods available the java implementation for this there being serializer available for net api but similar api not available for java implementation any pointer how convert object actual string json representation the default conversion from spring jackson converter work for but output the correct json and want write custom object mapper
29614690,openehr oet xml schema explore sample from the openehr ckm app and see that xml schema namespace for the oet template openehr template where that xml schema host far understood the openehr template namespace point xml template schema definition for version which not available for download tried use oet xml schema taken from distr but sample template oet files taken from ckm pass xml schema validation which openehr template xml schema actual and date
14016143,can xquery support tree structure query implement tree structure query mechanism use sql and entity value attribute based database design wanted see the performance the same functionality with xquery based approach assuming would possible use xquery for the task the simplified form tree xlm document follow there being different types node but the only attribute that use the query the archetype node attribute the node the test query attempted write aims select the evaluation node the right with element nodes the query implementation require two key capabilities from the language use the ability support structural definition with boolean operators and the ability define constraint for attributes nodes xml attributes this case with xquery have two problem seem manage declare reference all nodes interest that any node interest the graph figure how return the match since the match for the right hand side this tree have one composition with evaluation which turn has two elements here first naive attempt using flwr problem end pushing evaluation and element nodes subqueries since filtering base their attribute value and location work introduce them global variable the main flowr body even more clueless when comes return the result but want ask separate question for that ideally when enforce and constraint for evaluation have element both with at0002 and at0003 codes get the right hand side the tree and use constraint for the same element get the whole tree this doable with xquery works test the existence the structure look for the tree but also want access individual node update here second attempt this one actually open the door what try but not sure this the right way this xquery ask another question for improv this approach basically enforce the parent child relations with let statement and use return get values corresponding matches for let which turn may the same down the tree
23540152,transform hl-seven xml use apache camel routes new hl-seven convert the hl-seven-v2 xml use apache camel routes extract the hl-seven message from file can any one help how convert hl-seven xml
32487572,lung segmentation matlab try segment out the lung region have lot trouble incom image like this this essentially jpg conversion and each pixel bits above script generates interest entire inner black part with white matter well start couple days ago get how can clear you what kind output want let know upload image but think there need why need give threshold low with higher thresholds everything white black have read the documentation and understand the pixel with value less than being marked black and everything above white because bite conversion
19887480,pars cda hl-seven documents work project that give some cda hl-seven documents parse and extract the data and save them database find any good parser library that read the cda xml and return different section any idea what the best way approach this pretty new the healthcare tech field miss something but image there library that parse cdc object
23602546,how identify whether document follow cda ccd format working retriev data from clinical document cda ccd want identify whether the document cda ccd check the mdht java api but didn find related
42566823,hl-seven-v3 cda information that fall under establish field new hl-seven apologies and thank upfront what the procedure for store data hl-seven-v3 cdas that fall under the purview field the standard for trying store information about personal protective equipment ppe worn the patient and its status during encounter specifically trying contain information about eyewear helmets flak jackets etc there junk drawer field that opt for this purpose know that the whole point standardize data form and impose rigors but there must option for data encompass under the current option
16530339,how tell segment actually exist hl-seven message via nhapi have that contain pv2 segment however when get the parsed message from nhapi the parent group for pv2 the group return for which mean the pv2 present trying avoid writing code evaluate every field the segment pv2 just example there being lot more segment that miss from the message source use nhapi the latest version update following tyson suggestion come with this method
30045326,pentaho cda cache scheduler with dynamic data have sql query with parameter and dashboard user select any date range but still user prefer the date range for last day current week current month the dashboard have some huge data sql queries get too slow load the dashboard enable the cda cache make the dashboard reload faster but the data needs update hourly basis refresh require for every hour when clear the cache the dashboard too slow the first time loaded try schedule the query with the cda cache manager refer this url unfortunately unable schedule the queries with dynamic parameter how schedule the query with dynamic parameter also there any way clear cda cache for specific query kindly suggest your solution cheers
10325060,pars continuity care document ccd with sql figure how some basic parsing ccd use sql and thought share the result anyone know better way this please feel free comment particularly interested reducing the text associate with the namespace declaration know remove the namespace xmlns urn hl-seven org from the original xml however prefer that
917127,healthvault application write thick window form application must they write web applications well thats question seems that the barrier implement window form app implement the openid liveid login windows form app which the healthvaultpage super class for you other word think you implement healthvaultform super class and from there the rest the framework seem platform independent the reason ask that reasonable scenario implement user web with administrative thick app the other end miss the point that reasonable thing try and there even any way brian
51935517,how schedule individual medicationrequest administrations looking find the best recommended way implement the medicationrequest medicationadministration workflow possiblities that explored using the medicationrequest itself and runtime determine when the dosage occur and they fall withing the boundary the current shift use task create limited amount upcoming dosage tasks use medicationrequests resource base the original medicationrequest indicate each separate dosage pros option smallest storage footprint cons option require most run time work evaluate timing determine dosage require this shift more work determining missed dosages pros option common use task use against other orders procedurerequests etc for common workflow show all task this shift cons option default fhir searchpararmeters defined allow for search task restriction period which believe how you define the period which the task performed place link medicationadministration task supportinginformation but the field definition additional information for example patient height and weight doesn seem like appropriate put the task there possibly use provenenace and use that link task medicationadministration eventhistory but this seems stretch pros option medicationrequest intent have order and instance order value the documentation seems indicate that this would good fit overall request have intent order individual specific dosage have instance order medicationrequest have fhir defined search parameter time event that used find event for specific period cons option states medicationrequest resource query require access the all active medication orders the query example given get medicationrequest patient status active include medicationrequest medication this kind hint that they expect searche more done status than time period not really strong con against this approach but definitely not pro for use this method any advice about the method use other implementation appreciate
9678853,what difference hl-seven and cda what difference hl-seven and cda really until now haven get precise answer please help thanks
2147983,mirth connect javascript call webservice trying call web service from mirth channel transformer javascript use apache axis library which suppose deployed with mirth tried using the following java script but work any idea thank
1162110,count the number nodes xml snippet use javascript e4x consider this problem use javascript e4x non browser usage scenario javascript hl-seven integration engine there variable hold xml snippet that have multiple repeating node question how get the count the number pet nodes javascript e4x edit clarify this question should around apology those who answer without this information researched post this info beforehand
19848912,biztalk party being resolve for incom hl-seven-v2 message have biztalk application which setup receive hl-seven-v2 message mllp receive location setup parties order resolve based the sending application msh and apply our local schema the incoming message type which oru glo def the party supposed converting the schema from however whenever message hits the port almost seem like the party being resolve because receive error such follow another error the second error somewhat expected base the first since there aren ports subscribed look for messages type there being port subscribe there anyway check sure the party actually read the incoming messages anyone encounter this happening with biztalk parties how was resolve
19732699,how pull data out epic emr tool need intake data from epic emr understand that the hospital can write script that push the data secure ftp where pull the data down and load into system this correct also understand that this data hl-seven this correct thank you for your help
1517606,hl-seven certification material planning give certification hl-seven rim and cda any body know how prepare for these exam can any one provide good material
13059888,how parallelize existing executable the lab have piece software that use for mri analysis which involve lot data crunch there way redistribute the load generate the program across multiple computers gpu without edit the program itself
777933,hl-seven object model for net search for library framework that provide object model parsing validate etc the idea would able spin new object type hl-seven then call message type oru adt orm wouldn life great being able something like this
9636427,what template message encodeddata mean mirth trying learn mirth system with channel that pull from database for its source and output hl-seven message for its destination the sql query pull the correct data from the source but mirth output all the data the right spots the hl-seven message the destination show that outputting template message encodeddata what that mean where see the template that use the destinations don have any filters transformers confused
10855951,pypars extract variable length variable content variable whitespace substring need extract gleason score from flat file prostatectomy final diagnostic write ups these score always have the word gleason and two number that add another number humans typed these over two decade various conventions whitespace and modifier are include below backus naur form far and two example records just for prostatectomy look upwards thousand case using pypars because learn python and have fond memories very limited exposure regex writing question how pluck out these gleason grades without pars every single other optional piece data that may may these final diagnosis full disclosure physician research this first real work with python read lutz learn python shaw learn python the hard way and work through various problem sets review numerous pyparsing related questions this forum the pyparsing wiki and buy and read mcguire getting start with pyparsing asking question when told standing the death spiral frustation that common when you write parsers mcguire don know far just happy working what may actually real project
16217339,how read node value from ccda xml file using mdht use mdht parse the xml value ccda file but not able read value form consider following xml content family history any url reference appreciate
29661865,scikit learn projecting svm weights prinicpal components original image space pca image datasets and use the first pcs feature linear svm have svm weights for each now want project the weights into original image space find what regions the image being more discriminative the classification process used the inverse transform pca method the weight vector however the resulting image positive value whereas the svm weights being both positive and negative this makes think approach valid one does anybody have any suggestion thank advance
16473426,any available apis for epic emr trying send and receive information from epic emr what the best way accomplish this not aware any apis and wonder anyone guide any api documentation some other solution hl-seven interface engine solution
41616446,iterate over paged fhir response run query hapi fhir database which returne paged result back using hapi base java actually the search per the documentation here the code run far getting the first bundle and print the url expected however when tries execute the next bundle get connectionexception connection refuse connect the server still appear responsive however rerun program and have the exact same result returne any idea why the connection being refused get similar issue when try run manually from postman
7904613,what the accepted file extension use for pipe delimited files parsing file data whose field are separate pipes the record are separated newlines this similar csv file even tsv file but wonder what the accepted file extension for pipe delimite data see one specifically mention and found mention one the stackoverflow question referenced the article suggest that way extension from comma csv and tab tsv the extension psv everyone call pipe pipe though maybe there popular software package that use pipe delimite data and have extension for thereby set the facto standard
8639796,how keep counter how many times article view rail have model which image gallery want keep track how many views the image gets achieve this the controller however this only increment the views counter when access the full view and this method also prevent from cach the template also want increment view when thumbnail are present index collection view because those being valid impressions well well searche other presentation like favorites etc other word any time the full image thumb the image shown want increment the views counter there any pattern paradigm for achiev this rails should this javascript such that after the page loads get list every post the page then hit another controller which increments the views counter for all those post
41594321,set the timeout hapi fhir igenericclient trying run fhir search using the following code however when runs throw the exception fhirclientconnectionexception which cause the exception sockettimeoutexception assume that this the server time and not local connection since set local how about fixe thing use hapi out the box config and times search through relatively small amount resources within about second
57078672,hl-seven datatype inside xcn datatype taking look and when click pv1 datatype show datatype fields xcn show datatype and not just string how make example hl-seven with pv1 have datatype xcn that have inside too don get trying make example but seem right
20181318,make tcpserver recieve multi line message ruby have machine that send multi line message tcp server however when use any simple ruby server receive the first and last line separate message separate connection tried using and pretty much everything find but now stick the machine definitely send the whole message quick python script display the whole message for reference one the ruby servers being use rails project config initializers output from the ruby servers and then the last line repeat but this expected the machine keeps resend the message every 60secs the python server output from the python server expected and ideal output thank you advance
40235522,failed call access method exception when creat medicationorder fhir using test fhir server and work okay far now get http failed call access method exception anyone have any idea what have gone wrong
44307730,java heap size error mirth use mirth connect and have xml file which almost 85mb size and contain some device information need read this xml file and insert that data the database sql server the problem face when try read the data show java heap size error increase server memory 1024mb and client memory 1024mb but show the same error increase the memory more not able start mirth connect any suggestion appreciated thanks
8765703,implement hl-seven parser listener java background write medical record app for friend who doctor was told write listener the app that await hl-seven message that way hospital send hl-seven message and listener catch them come the hapi site and view what understand from that creat server listen for message developing this eclipse use jsf tomcat where one normally put this kind listener project with jsf tried searching online for this answer and find nothing question know this code inside class when the class gets call the socket turne and going wait for response want call this class soon the project deployed how that done how call that class only once when the app start order turn the listener any and all help greatly appreciate and clear something let know
57009966,smart fhir client invalid character error ie11 note the issue also report please take look git issue well for current progress investigation using develop smart fhir web application that run ehr launch scenario for example epic hyperspace simulator that uses run the smart application while test application locally localhost ie11 get javascript error from within fhir client below being the two line from code order any solution workaround would much appreciated update upon further investigation find that sessionstorage empty when line with json parse executes however strange thing why how sessionstorage get empty after redirection from authorization server this only happen with ie11 everything work fine chrome though can someone please add new tag smartonfhir
43922703,pars hl-seven message with newest nhapi parser version starting work with nhapi try parse some message hl-seven version with nhapi model but work how parse hl-seven message previous version say with newer hl-seven nhapi version say there some way this the only get the version with nhapi base parser pipeparser and than use the specific version like
57098104,mirth how handle response when have multiple destination create channel with destination each one the destination have different response and decide use filtering message source example sending message destination filtered return response destination sent return response want source response response but not example sending message destination sent return response destination filtered return response want source response response but not how set source response match sent destination tried set source settings response each the mirth drop down option with success
57614298,python hl-seven listener socket message acknowledgement trying create hl-seven listener python able receive the message through socket but not able send valid acknowledgement python code
18958731,trying read htmlelement from ccd xml use java pars ccd xml use java each node element ccd access use java object query while htmlelement come any node ccd java object reach that node get templateid title but after reach text node ccd xml java object not able show table node sample ccd xml shown below any help much appreciate
10400380,implement mirth hl-seven transformer conditionally change field use mirth read hl-seven message the emr provider request that for physicians specified practice insert practice code msh field list the physician codes what need say the physician code orc this list then change msh this value entirely sure how this and unfortunately the mirth documentation put sparse this area get the transformer extract the physician code but how the conditional update
51164191,any hl-seven field relate equipment manufacturer model there any hl-seven fields used identify equipment and medical device manufacturer model dicom there being some attributed manufacturer model software use identify the vendor model information the device there any similar attributes hl-seven message
39449139,fhir medication have data model for medication like this drug name prescription date preparation dose quantity for bendroflumethiazide bendrofluazide tabs 5mg tab look the medication resource but unable map can anyone help with this mapping thanks
41743176,import snomed into neo4j need import snomed ontology into graph database this case neo4j but can another choice eventually however find clear depiction snomed underlying relational data model order achieve this least simplified sql view that expose entity relantionship way that map graph database appreciate any guidance previous experiency with this matter
54137079,number unique sections cda schema read ccd summarized version cda and has includ the header couldn find how many overall section there being when there being full fledged cda documents
35150641,how use addforcedencode write all field even empty msh and msa messages need respond system that requires message with all filed even they being empty think use the parser configuration addforcedencode but don know how add the rules path say write all fields the msh and msa message now when send response have this and obtain this can you help thank you
