id,text
9942378,mirth process multiple segments here some map for next kin then process this have the javascript below the reason that try this time get multiple next kin segments come through that the case mirth throws error details typeerror assignment list with more than one item support but unfortunately script doesn work doesn throw any error but doesn what suppose for multiple segment work for single segment this outbound message
44725564,mirth open source support channel that work over http use ssl this basically question investigating mirth connect for company but least start need this work use only the open source version course hipaa require that all message send done over http use ssl the open source version support http out the box look the administrator channel setup and see obvious way force connection use http support how you set
45296180,mirth connect how create channel make http request day requirement that need download some certificate everyday for this have our application and when manually sent request certificates are downloaded our application folder now looking automate creating channel which make request the every day mirth channel set and other configuration being done but get about configuration need done for can any one please suggest what should the considering the requirement thank advance
18179609,mirth connect deployment strategy and failover strategy first time deploy mirth connect hospital have build the channel and everything with mirth and its working file but with the deployment strategy confused mean use mirth appliances deploy our own server prefer linux the problem with deploy with our own server that how build the failover strategy with suggest about implement failover strategy with mirth connect
12920099,set mirth destination send transform data back custom ack have mirth channel that set web service listener receives build hl-seven query message and send this query and eventually get hl-seven response channel name querychanel source connector type web service listener destination connector name querytovista destination connector type llp sender this the typical hl-seven response receive back from query follow get all the above return set source response from parameter querytovista however want return only the value from the above message tried play with the transformer the querychanel destination without success update tried add javascriptwriter connector after the querytovista connector the same channel follow seem use the normal transformation retrieve the element all thank you
4548333,mirth change default ack field value using mirth with llp listener receiv hl-seven message the customer expect ack message from and check the send ack radio button the only problem that the default ack put mirth the msh field need change this another value say where come from this possible
43350459,how should one send acks mirth from web service want write simple web service that use mirth send hl-seven message this web service can simple cgi script and need accept the hl-seven message string and possibly couple other value post request using mirth http sender this seem simple enough but how should this web service send the ack let mirth know everything something wrong there specific format that mirth expecting response there some way tell mirth what expect note want use mirth the receiving end
17357943,how get response from another channel mirth have two channel calle and channela have two destination first destination invoke the channelb with xml data input and get the response from the channelb xml format retrieve the response first destination xml format and process getting channelb response how get actual xml from instead message above step define generic channel such that reuse different scenarios the mirth application use mirth version
13358423,mirth traverse through globalmap mirth implementation mirth connect server have globalmap that contain key and property come from external property file how get the key set from the globalmap and iterate get the value
53437475,how create mirth channel utilizing rest api want export channel message ftp server external drive thing export message via rest api can you any one help this
795462,how load static data mirth avoid many roundtrips database broker help with healthcare application hl-seven message integration question about save yourself the trouble hit your own datastore everytime you want lookup some data contain within the hl-seven scenario for each message received the channel want find the facility mnemonic code and get the full name the facility unfortunately ask the sender the hl-seven message send along the message for write own access code call stored procedure pass the and receive the full name any idea how create cache data mirth that you access the lookup from any channel source destination transformer filter
43076691,mirth hl-seven ack error message control ids match starting with mirth and hl-seven and trying send message remote server looks follow the response looks follow and get error say far understand this error mean that the message control which returne the message not the same from what see the number the message control and see that number both the message send well the the ack which returne what wrong here and who fault the remote party anybody know how solve debug this
33485475,read globalchannelmap from destination template have source connection read and construct output all javascript the channel source need pass this along access from the destination use inside the destination the template window for file writer have but write exactly that the file want everything inside that variable write the file
52101102,how process only the most recent file directory use mirth connect attempting create channel designed take binary file from sftp site and transfer second sftp site the source site update their file friday creat the channel run every sunday the main issue that want leave processed files the source directory and only process files that been deposite between the weekly channel run something like this doable mirth connect and what the most efficient way accomplish
947078,mirth inbound message template that not the same the channel source type the problem that the inbound message template expecting different type than want specify work with the requirement have single channel convert hl-seven call web service then convert the soap result xml and convert that hl-seven and send the original caller this must done asynchronously setup consider the situation mirth channel source llp listener type hl-seven the sender the hcis health care information system source transformer not relevant problem hand destinations order javascript writer call into code template some database work soap sender call web service which return hl-seven javascript writer contain handful transformers writer call into code template the problem lie here javascript writer again call into code template the postprocessor generate custom acknowledgement send the hcis problem the inbound message template expects hl-seven because inherits the datatype from the source need map hl-seven template outbound message template the outbound template work fine bind anything have tested this setup another channel with hl-seven the incoming datatype and works question how force mirth recognize inbound message template hl-seven instead inherite the channel incom data type
29377921,use environmental variables mirth connect possible use environmental variables mirth connect either the destination content the destination url
30445572,request response issue biztalk one our solution pure messaging orchestration receive message request response receive location use the mllp adaptor and hl7v2x pipeline the receive pipeline generate the response message and publish which due promote property gets rout through the send pipeline the request response receive port back the client then have two way send port that subscribe the received message uses map translate the message and send request response wcf receive port that also the same biztalk machine sound odd but have client that send their data via web services and some that send via hl-seven mllp that why this way the wcf request response receive port also generate response publishing message and promot the epmrrcorrelationtoken correlationtoken reqresptransmitpipelineid routedirecttotp isrequestresponse and receivepipelineresponseconfig properties which cause the response get routed through the send pipeline soap response subscribe the message receive the wcf request response port and drop them file works the client using mllp get acknowledgement response the client using wcf soap web services get soap response the file system contain all message that were sent think about the message published imagine there the hl-seven message received over mllp and the hl-seven response then the translated message receive the wcf receive port and response plus the wcf response that was receive the wcf send port shown the attached the problem that getting suspended message biztalk such response message for two way receive port being suspend the messaging engine correlate the response existing request message this usually happen when the host process recycled this case the service the mllp receive port and there are suspended message the hl-seven ack and copy the response message for the wcf service and suspect seeing errors the instance complete without consum all its message the instance and its unconsumed message been suspend
10727972,biztalk can parse message msh date time message specified milliseconds have standard directional interface use biztalk our interface engine what happen that receiv order message that parse fine except for the fact that they sending date time msh milliseconds the extra number cause fail with data type error remove the extra numbers msh the message process fine add layer complexity find this post which describe the issue and suggests change the msh schema order fix did that and work where process the message well result message back and seemed working fine however when attempting generate ack completely fails think there may similar issue for batch but didn get that far changing the msh schema the build ack functionality longer work because the msh header have unexpected form think starting run idea and thought try posting here find many answers here travel the weirdest part that msh defined string the msh schema seem like shouldn matter what they pass this field
21434426,customize hl-seven adt message with biztalk btahl7 accelerator very new dealing with hl-seven and company recently begin very large project which receiv various adt message the hl-seven specification already use biztalk extensively here and the plan leverage the btahl7 accelerator for biztalk accept these message issue this the adt message receiv from our trading partner match the hl-seven specifications for pretty much all the message receiv even though the msh segment for and they tell that the version they sending files instance they send message and the pv1 field the spec call for subcomponent separate the standard delimiter what they send that field subcomponents example f11 instead this which match the spec this also happen for the pv1 field after scoure the internet find any help for deal with this kind situation biztalk use the accelerator seem that people customize the data within the message and that happen often for instance send string where the spec call for int but change the actual layout the situation list above when deal with hl-seven and biztalk these message fail even when don set biztalk validate body segments custom data types which makes sense and expected because they aren send strange data that still conform the layout the specs but rather entirely different layout question this there way deal with this utilize the accelerator functionality without having write custom code fix the file before send them the accelerator pipelines accord our trading partner this just the way their product cloverleaf send the data and that they work with various other trading partner with this format
19848912,biztalk party being resolve for incom hl-seven message have biztalk application which setup receive hl-seven message mllp receive location setup parties order resolve based the sending application msh and apply our local schema the incoming message type which oru glo def the party supposed converting the schema from however whenever message hits the port almost seem like the party being resolve because receive error such follow another error the second error somewhat expected base the first since there aren ports subscribed look for message type there being port subscribe there anyway check sure the party actually read the incoming message anyone encounter this happening with biztalk parties how was resolve
19869939,hl-seven accelerator error schema find after upgrade biztalk dev machine upgrade biztalk server biztalk send hl72 messaves from another machine this one and get schema find error alternate error number alternate error description schema found alternate encoding system hl-seven bta the message specify lab the sending application and have party calle lab which specify the schema namespace figure why look for the oru schema the default microsoft namespace our message looks follow anyone have ideas try
21835607,identify hl-seven schemas for cda the company work for recently start project delv into the world hl-seven message and data trading use biztalk server with the btahl7 accelerator for with success far for hl-seven but now need accept hl-seven cda documents these being ccd accept from external vendor have the full suite xsd schemas from hl-seven for cda all them but struggle with how figure which schema relate the message receiv all have work with being test ccd message from our trading partner and other information tried use the code and display name along with the templateid figure which subschema this match map into our internal canonical format for data loade but struggling figure that out rather create one project biztalk that hold all schemas parse and validate these file that make reading map and transformation mechanisms that much more difficult have anyone with experience hl-seven and biztalk get any guidance how identify the appropriate subschema base the information available the test file here the header information
24944922,promot fields hl-seven schemas for use correlation set say were create promoted property hl-seven schema want use this promote property order correlate two message parallel convoy dummy application without use hl-seven schemas and all work just expected sum what see quite simple which why wonder there catch when come the hl-seven schemas create the propertyschema promote the field after the hl-seven body schema everything compiled and deployed fine run query for the subscription receive port and they look however get and look the biztalk group admin console when view the suspended message don see that the property promoted edit add message context error report context check and double check the schema being there there being duplicate schemas the event log even show when receive message now guess questions the promotion happening would they show the message context dialog they hl-seven dummy app they aren supposed show there set property anything somewhere miss that unique using hl-seven schemas
14942833,tool automate iec and fda standard requirement look for free software tool set tool automate the document generation that require the iec and the fda standards software medical equipment basically maintain traceability between different document issue bug trackers svn source code test cases etc report generation document version control project track auditory function etc
13723892,misra equivalent for medical industry pretty much the title there medical industry equivalent document standard set either the auto industry misra work the area but anything language agnostic would good too
44729165,how pull all search result quickly from fhir server use the fetchall function instance fhir client specifically use the hapi fhir server trying collect all observation with certain loinc code from understanding request sent the server telling create bundle with all observation that match the loinc code this search seems handle server side the result are sent however the server only send result time there being observations the time receive the bundle from the server minutes use chrome which limited believe connections the server other browser being similar would like this kind request faster possible there way think there some way get the bundle contain item anyone know how this search parameter thank
33427604,possible skip pars some field hapi use apache camel mina2 and hapi receive hl-seven message notice that its taking lot time unmarshal and create message object and this time increase when have larger message message has around obx segment and use obx and obx field only tested manually remov field after obx and find some improvement performance there any way tell hapi parse any field after obx
36420013,open and read thousand file fast possible need open and read thousand file fast possible have run few tests file and find method slightly faster than method these file being usually between byte and 4kb know there anything make this bound process faster here the code the files reading being hl-seven file and look like this once open the file parse the string with and close the file
33170789,sequencial concurrent hl-seven message processing wonder what kind concurrency models folks process inbound hl-seven message adt and persist them normalize data model relational sql struggle with the thought sequential message processing map nosql and multi thread when transforming process them from the java net whatever example process message received and transformed clover leaf transformed compliant with internal web rest api expected payload and set internal web rest api server multi threade java web app then guarantee parsing the message sequentially due threading process message then mapping will slow
41322603,mirth performance benchmark use mirth connect for message transformation from hl-seven text and store the transformed message azure sql database our current performance message per hour machine configuration ram and core cpu memory assigne mirth xms 6122mb don have any idea about what performance parameter for mirth with above configurations anyone have idea about performance benchmarks for mirth connect
47966020,anyone able use swift smart fhir with ios have terrible time trying figure the oauth process for ios app into the allscripts fhir sandbox hoping use smart swift seem handle this login but keep getting error the latest after loade the cocoapod and open the workspace just get error that there module name smart have anyone able successfully implement this pod anyone have recommendations how setup the oauth pretty new ios and trying learn this piece but find anything that great with the latest swift love any help pointing the right direction for some good training oauth 2on thirp part app
56828622,azure fhir generate token php how generate token for azure fhir server use php what want that the backend php use guzzle generate token that use the auth header access the fhir server try this guide but will open azure portal login want able generate the token seamlessly just like other 3rd party api
53063004,net fhir client with token example looking trying find example leverage the create fhir client server side and pass authorization token that being pass from smart fhir client application web server make calls the fhir server where the token was generate valid and find any example token the fhir client before make the call the fhir server the net fhir documentation the examples being all hitting public endpoint just add search parameter there something missing that need leverage the token when call public api that require the token notice that there token type the search parameters but not sure how leverage here basic example make generic search call observation endpoint where think need add the token search parameter
18525927,best practice for keep the web server data protected say run medical facility and want website where users patient lookup their private record what would the best solution against most common attack even use private server buy somewhere and rely its monitoring services there good chance someone find security hole and steal data end business what being the best practice for such architecture
756850,security requirements for medical application research cod requirement for medical application but find anything useful structured looking for structure possible xml file document with the list security requirement for example what kind encryption they use what feature the app disable the default what log info store and how store etc course requirements can different for different app and company just need some general information and possible for the
46308820,permission within blockchain everything read about blockchain from understanding says that even private blockchain every participant view all transaction seen mention that use case for block chain can the sharing medical data for have blockchain that hold the medical history every person from birth death country there way set permission that only data relate person and those who been given permission that person data view the data store every node blockchain how person computer supposed have the capacity store the medical data every person country
38713466,secure hl-seven transport ws02 esb group evaluate hl-seven proxy and come across ws02 esb configure hl-seven proxy that seems work well now task secure the listening point with ssl tls specifically this seem like something that the esb should able handle https secure web services etc however there doesn seem enable this with simple check box for hl-seven proxy nor find any documentation how enable manually even possible secure hl-seven proxy within ws02 esb thank advance
51831891,mirth connect open source support http without use ssl manager try setup free verion mirth connect version for client need setup interface with http connector what being the necessary certificate require connect over http can anyone list out all the checklist certificate
14356431,best way store recieved hl-seven message from customer database all new mirth want know the best way store hl-seven message mysql database table where store only one column hl-seven message row and column like sending application column receiv application column etc unable find suitable answer help thanks advance
17318911,store cda xml sql server have lot cda xml files need store them sql server database there any tool which can this know can that via ssis also there any way generate database schema use cda xml schema
46042187,how insert create timestamp mongodb use its java driver for javascript trying use using javascript insert the created timestamp just the first time hit mongo and receiving message that say that invalid bson field what btw this javascript mirth and already have its jars they work fine when just insert document but have this problem when want create the timestamp update when trying use mirth gives this error when use this line even using update don know how use the setoninsert function from this sincerelly not good when come javascript
40701191,mongodb for hl-seven fhir learn fhir and trying implement with mean stack which use mongodb database seek your help question when get the post request for new resource docment insert into mongodb since the mongodb add the object the resource unique when retrieve the document have the extra field think make the resource compliance any more since the define the resource know how handle this issue will this extra matter the fhir resource best regards autorun
25274848,fhir spark net make mongodb storage hipaa compliant look for way make the mongo storage use spark net hipaa compliant use mongodb ssl transport encrypt data wire and use gazzang for data rest good enough being there other option for data rest while still allow for index certain properties json
2516752,anyone using nosql databases for medical record storage electronic medical record being composed different types data visit information date location insurance info seems lend itself rdm other type medical infomation such lab report rays photo and electronic signature being document base and seem good candidate for document orient database such mongodb traditionally binary data store blob rdbms hybrid approach use traditional rdbm along with document orient database seem like good alternative this other alternative would something like db2 purexml the ultimate answer can that depend but really wanted get some general feedback ideas this anyone using the nosql approach for medical record clarifying question clarify anyone using nosql databases such mongodb cassandra couchdb for medical records production environment
9786251,use hl-seven message insert data sql server use mirth for send and receiv hl-seven message possible insert custom data char datatype sql server database pick hl-seven message file type map with columns database use transformer and insert database and there any option generate status outbound hl-seven message mirth
