id,text
6685279,create ssb site specific browser emr applications planning create web application emr for physicians nurse and other medical folk since these folk being technical they frequently tend stumble with basic operations the browser and that become hurdle their patient management note that most hospital use custom emr applications their intranet not sure the application access from out side the hospital also case plan make accessible from anywhere planning create web application with site specific browser ssb order have complete control over the the browser buttons thus provide only those control that the doctor understand looked mailplane for gmail and some site which conduct online exam think those folk use ssb question what being the best tool available create ssb site specific browser applications that work win mac linux would good too being ssb common paradigm there something better than that ssb model dumped favor regular web application with more training given the doctor ssb paradigm more easier adopt mobile devices ipad android etc neede down the line one the drawbacks ssb compare web applications that whenever add new feature have update the application each client computer unlike regular web applications where just cut the new release and restart the tomcat there some remote desktop management the application neede case ssb correct wrong now just know adobe air get very good development support for ssb not sure there being others which being better
26515298,fhir migration and backward compatibility system implementors face dilemma when migrate from one version fhir the next started off use fhir and then move svn revision sept incorporate bug fix suggested downloaded the java code from svn trunk and followed the directions the fhir incompatibilities now that fhir available want upgrade released version after downloade however notice that several resource appointment that being trunk rev2833 are release this lead our first question what trunk contain contain the latest code destined for the next release should anyone ever use what trunk there release branch from which was create trunk incompatibilities since our code have dependencies resource introduce trunk but included continue checkout fhir directly from svn oct downloade svn revision java code when integrate that code into our system discover numerous compatibility issue here being some them various enum values change from lowercase uppercase includ patient administrativegender and humanname nameuser though conform the java nam convention good idea change fundamental data types break compilation method names changed resulting compilation errors also discover that simultaneous name change occurred for example the humanname class the old settextsimple string now settext string and the old settext stringtype now settextelement stringtype both the name and parameter type settext changed making migration error prone because one has decide each use whether change the method its parameter the resourcereference resource type change its class name the fhir model package alone occurence resourcereference file were affect this include changes that ripple through other fhir packages change that ripple through our application code and our database schemas notice several new resource the rev3218 trunk code includ newbundle previously suggest that bundles resource great see this change since trunk not backward compatible with the releas however not sure have support the both the old and new way pars and compose json and xml bundles put finer point thing important recognize that some the above fhir changes affect compilation but introduce subtle bugs runtime addition the fhir changes require database schema change and data migration some application for example our application save json resource stream database something simple changing enum value from male male requires migration utilities that update existing database content going forward investing fhir want succeed and adopt widely standard order for that occur issues backward compatibility and version migration need addressed that vain any light that shed the following question will move all forward what the purpose the line code who being its target users what the purpose the code trunk who being its target users user ever expected migrate the trunk codebase what migration strategy used address the many incompatibilty between the codebas what the deprecation policy for code each codebase what level backward compatibility can expected from revision revision the code trunk there fhir roadmap that system developers use plan there own development cycles thank rich
40235522,failed call access method exception when creat medicationorder fhir using test fhir server and work okay far now get http failed call access method exception anyone have any idea what have gone wrong
47645669,how validate large value set within hapi fhir framework have custom implementation module for validate all profile and value sets code systems trying figure use the same validation api support validation very large value set currently the default implementation validating value set code system within hapi fhir relies expand the whole value set and match the submitted code against any the concept within the expanded value set there way the validation without the need fully expand the value set
47867185,how fhir trying learn the basics fhir and want implement node come across the following code that say that create instance fhir client know question dumb get any clarification the topic started learning node few day back thanks advance above the code for creat instance fhir client want know where implement this code and access fhir server
51384447,why hl-seven fhir json resource have root element implement fhir server able receive resource both formats xml json order make simple consistent idea internally work just with xml and translate json request xml and vice versa but although work with some sample json documents work with fhir json resource the main reason that fhir json resource have root element the xml conversion tool create proper output xml fhir json observation resource like and with root element should aware not mandatory for json document have root element but most xml json converters work better that scenario and fhir accept both format why define fhir json resource with root element specially when seem that some initial dstu use that approach thanks
16802181,retriev subset fhir resource all interest the ability retrieve specific element within fhir resource use single url call suppose interested the gender patients read the using the url without having walk the xml node path every time right now this functionality appear exist what you think about the usefulness this get sense the community interest thank jeff
41110920,what mean fhir compliant work solution for the hrrp want make server fhir compliant but what fhir compliant mean hrrp solution have some data that match any the pre define resource for example the hrrp solution involves calculating scores like readmission ratio payment etc
33303231,resource specializations the fhir schema define very generic resource that represent concepts implementation and the meaning the resource difficult impossible determine from the object itself for example the condition resource represent problem problem list admission diagnosis final diagnosis primary diagnosis etc the meaning the condition depends know which these there way make this explicit fhir some cases profile structuredefinition used distinguish between specializations resource but this doesn work for thing like final admit diagnosis since these contain the same data there discriminator and not general solution
31124860,how represent the patient room number fhir resource look the fhir documentation for patient resource find specify patient room number pertains organization facility that they associated found the location resource type but don see how associate that with patient thought
33222834,which resource use comment fhir observation make web tool that show fhir observation resource these are measurements taken home blood pressure weight etc the patient themself then want health worker look the graph and able comment guess the comment link invididual observation general comment about the patient which resource use for this comment
36227613,represent pcp history fhir background dig into the fhir dstu2 specification try and determine what the most appropriate resource represent particular patient historical list gps pcps struggling find ideal resource house this information the primary criterion using identify the proper resource that provide values associate patient practitioner for period time question what the proper resource represent historical pcp information that tie patient resource what explore here list possible pick thus far paire the resource types with thought process why not confident about use episode care this seems have the most potential have the association between patient and set doctor for give time period however when read its description and use case scenarios seems bastardize its usage fit need since embody period time where group relate health care activity were perform group very generic structure that can fit base its definition however want rule other option before take this approach care plan similar episode care rational seem like bastardization just use this house pcp history information the scope this much bigger and patient condition centric understand that there may clear answer and thus the question run the risk becom subjective and apologize advance this the case just wonder anyone provide concrete evidence where this information stored thanks
40550229,representation clinical notes fhir this basically modelling questions clinician keep lot important information document inside clinical note for various type encounters how fhir specification suggest model these note look the fhir documentation provide clear guidance appreciate your help advance
40083859,can someone explain fhir extensions try wrap head around authore profiles fhir the trouble have around the use using extensions the documentation talk about extension they being just there extend existing elements the resource which profile belong this kind confirmed when use forge because add new element which don have extension feel very foreign our proprietary storage system have the equivalent profile and they have property about them which think being similar elements fhir however property designed store one type thing you have patient profile that have the properties dob ethniticy identifier etc don really understand what profile being for the context fhir being they similar property use the limit the datatype that profile instance have for particular element there any better documentation than the spec find really hard get grip with
35822318,how store user fitness fitness device data fhir being currently the process evaluate fhir for use part our medical record infrastructure for the ehr data allergies visit etc the hl-seven fhir seems have appropriate mapping however lots data that deal with relate personal fitness think fitbit apple healthkit active exercise aerobic workout quantity energy heart rate routine activity such daily steps water consumption sleep patterns quality odd case inter lap state within the same timespan other user provide emotional rating eat activity women health while there the this still seem best fit for the ehr domain particular the user fitness data collect during visit and human verified the goal find standardized fihr way model this sort data use observation with extensions profiles domain specific rules fhir allow extraordinary flexibility but each extension profile increase the cost able exchange the resource directly later explanation the appropriate use fhir resource includ when extend use profiles tags encode differentiation via coded values would useful define new custom resource type fhir dstu2 define define new resource type wanting indicate that the role resource logical concept implementation interface not understood don use fhir all don use fhir except summary interchanges can also the case that fhir not suitable for our messaging format but would any worse than when deal with external interoperability the seem contain any user fitness specific observation profiles and none the seem add appropriate resource refinements the end the day would nice able claim able with minimal translation standard manner able exchange user fitness data fhir stream
55861712,what the difference between and identifier for fhir resource the entity define attribute logical this artifact meanwhile for resource like define attribute named the description external identifier business identifier wondering what the difference between these two attribute from the restful api definition like the used locate the resource like after another should able retrieve that resource use like something similar storage identifier then how about that
38050684,how handle internationalization display string for fhir observations work multi tenant application cater customer different country when display measurement results the display labels measurement values need different languages label for measurement values receive one tenant need translated that tenant language assume that the user patient employer that understand the same language what good strategy for storing displaying translate string perform translation when store the value and add custom value better translate existing values when render the view
51935517,how schedule individual medicationrequest administrations looking find the best recommended way implement the medicationrequest medicationadministration workflow possiblities that explored using the medicationrequest itself and runtime determine when the dosage occur and they fall withing the boundary the current shift use task create limited amount upcoming dosage tasks use medicationrequests resource base the original medicationrequest indicate each separate dosage pros option smallest storage footprint cons option require most run time work evaluate timing determine dosage require this shift more work determining missed dosages pros option common use task use against other orders procedurerequests etc for common workflow show all task this shift cons option default fhir searchpararmeters defined allow for search task restriction period which believe how you define the period which the task performed place link medicationadministration task supportinginformation but the field definition additional information for example patient height and weight doesn seem like appropriate put the task there possibly use provenenace and use that link task medicationadministration eventhistory but this seems stretch pros option medicationrequest intent have order and instance order value the documentation seems indicate that this would good fit overall request have intent order individual specific dosage have instance order medicationrequest have fhir defined search parameter time event that used find event for specific period cons option states medicationrequest resource query require access the all active medication orders the query example given get medicationrequest patient status active include medicationrequest medication this kind hint that they expect searche more done status than time period not really strong con against this approach but definitely not pro for use this method any advice about the method use other implementation appreciate
27136383,fhir medicationprescription dosageinstruction dosequantity handle dose range the dose expressed range can this handled with the fhir medicationprescription dosageinstruction dosequantity
39449139,fhir medication have data model for medication like this drug name prescription date preparation dose quantity for bendroflumethiazide bendrofluazide tabs 5mg tab look the medication resource but unable map can anyone help with this mapping thanks
34302188,access procedure reason fhir model use the fhir net api with dstu2 parse json object models everything work well except that access the reason element the resource type procedure example parse follow json object the procedure model use the fhirparser and the generated object has follow entries excerpt access just fine but won work with the data json object wrong see that reason type hl-seven fhir model element and report type hl-seven fhir model resourcereference there way change reason hl-seven fhir model resourcereference and then access the reference element would grateful for any hint thanks regard trammy
37984505,hl-seven fhir net model include profile created using forge dstu work with the hl-seven fhir net api reference implementation utilize the existing resource models embedde the library now trying use the forge tool modify the resource contraints extension suit requirement notice that the hl-seven publish mechanism generate model from dstu onwards and wonder what the best way convert profile created using forge into resource classes such that they include into the hl-seven fhir model assembly that part the reference implementation
37831561,embed questionnaire score data into the fhir questionnaire response have system where citizens download questionnaire from server fill and submit questionnaireresponse back into the server store there our case these being simple question about how you feel and symptoms health worker access the questionnaireresponse the health workers don want the answer but score which calculated base the answer some vendor non fhir allow creating form and score system the same time wanted support this within fhir assuming have embed the scoring information inside the questionnaire potentially separate resource but that give some redundance perhaps this best solved with extensions the questionnaire resource another resource some other mechanism and what the best way implement the actual scoring would best separate application which subscribes the questionnaireresponses download the questionnaire extracts the scoring system evaluate and then write the score back into the questionnareresponse being there other standard look for help this and for those especially interest here really simplify questionnaire resource typically question course right now put the score into the code which doesn seem like good idea extension look like this embedde each option
4680906,guide hl-seven implementation trying get handle hl-seven and far reasonably clear the data structures and encod protocol where remain mystified the actual implementation mechanics sequence request ack response ack and such thing need ack ack etc what receive nack ack etc any pointer where start looking learn about these thing
41829553,fhir custom extension add add custom extension schedule resource app schedule visit motive reasons know there list classified appointments encounter reason but use mine have something like this not sure about this part correct add extension this way there being always multiple visit motive for specific schedule list them also see this kind thing which one the correct one wrong
32348567,access and schedul fhir questionnaire resource trying understand how use the fhir questionnaire resource and have specific question regard this project specifically regard how citizen our country respond questionnaire via web app which are submit the fhir server questionnaireanswers read analyzed health professional fhir base system have lots questionnaires group even specific targete towards certain users groups users the display the questionnare the citizen based care plan sort example certain questionnaire needing fill the week after surgery the questionnaires can also regular one that need filled every day week permanently support data collection the state chronic disease what wonder fhir have resource which fit into organize the logistics display the right form the right person see careplan which seem partly fit this something that handle out fhir scope specific server implementations summarize which resource mechanism health professional use set that patient answer certain questionnaire either regularly part for follow after surgery this include setting the schedule for the form fill and possibly configure what happen the form wasn filled require which resource possibly the same mechanism use for the patient web app retrieve the relevant questionnaire given point time
56663245,fhir how check whether the exposed json proper fhir standard have create patient resource using fhir there any tool mechanism validate whether the created json object proper fhir standard
40586787,why isn fhir resource validate against profile trying validate instance the resource type basic against the following profile which created uploade the profile local hapi server then try upload resource and validate using the following url url basic validate profile url structuredefinition stelar profile questionresponse this the resource when upload happy get number error code returne with the message unexpected failure while validate resource not really sure how find why fail though how about this can anyone spot what the issue with form
38577397,access resource within bundle hl-seven fhir wonder there way access resource within bundle diag currently what causing issues since have client access their report via that generate thus the bundle search command but access all the other resource that being referenced diagnosticreport find way either separate the resource from the bundle directly grab from the bundle thank you
33157757,how represent contained resource the net fhir dstu model try construct resource for the purpose the evaluateorder transaction for gao accord the spec using contain resource shown below the problem have that the net object model seems require resource reference there any way contain the data within the reference this use case outside the intent the model gao order spec
16598979,fhir resource that support concept know allergy there know allergy mechanism define hl-seven fhir resource somewhere the specification
27463373,how avoid duplicate when creating update patient resource from message been successful translating hl-seven message fhir resource and post them server what has given headach however the question how avoid creating duplicate during update accidential post example get adt message with pid create patient ressource with identifier and post the server identified system and value the patient should unique any environment even there being several system feed patients the server next receive adt message and want update patient create another ressource with the same identifier above but post the server get two patient instead one update patient using put post option since put requires provide the patient url which don know from the message trying process ewout kindly referred the dstu2 transaction with conditional processing which allows put patient resource bundle and add status match with search property the specification the server side behaviour states the search return one match the server use this match resource that already exist instead and ignore the submitted resource this prevent from accidentially creat the same patient twice but since positive match results the server ignoring provide data still leave with way update patient course run query identifier first and then update the returned ressource but since the server obviously treat the identifier unique constraint can sure that search yield exactly one result there human interaction require every time the server return more than one result long story short what the recommended procedure for system knowing patient identifier but url submit updates fhir server best regards simone
46831237,there easy way generate sample fhir resource without use commercial tool there easy way generate sample fhir resource work project store fhir message elasticsearch and need tool generate fhir sample message real time ship over tcp
31061829,fhir and hl-seven used fhir replace understand general the constraints the rim model and the steep learning curve which has led many its failures although fhir have clear strengths scalability and application mobile device being develope total replacement alternative its alternative what being strictly the different use for each
11037103,there exist notepad syntax highlight profile for hl-seven there exist notepad syntax highlight profile for hl-seven started make own but custom user define language already exist with all the segments etc that would great
1008897,emr electronic medical record standard record format few associate and myself start emr project electronic medical record heard talk the past and more lately about standard record format facilitate the transferring record when appropriate hipaa from one facility another have anyone see any information this
21998127,hl-seven difference visit number account number encounter number have trouble decipher the differences between key concepts hl-seven would someone kind enough explain the difference what the following being what visit where the visit number typically locate what encounter number where the encounter number typically locate what the difference between encounter level and visit level hl-seven what the account number
8580391,idenfity hl-seven data anyone aware tool identify anomomize hl-seven basically look for tool identify both individual and batch hl-seven message
