id,text
35590046,use ascii inside hl-seven segment valid way represent new line place ascii character somewhere inside segment hl-seven message represent new line character this valid from what see recommend use x0d x0d0a represent new line character for plain text format hl-seven use just the ascii character explicitly invalid hl-seven
57078672,hl-seven datatype inside xcn datatype taking look and when click pv1 datatype show datatype fields xcn show datatype and not just string how make example hl-seven with pv1 have datatype xcn that have inside too don get trying make example but seem right
23525727,hl-seven segment message type segments being there any restrictions the segment that use for specific message type for create sample hl-seven adt ref message include any segment that like hl-seven have some rules defined choose the segment for specific message type the below hl-seven message correct
42967760,two surnames hl-seven pid segment how about write pid segment hl-seven for patient who have two surname that are hyphenated use space between the two surname for example patient name jessica marie lewis williams write the field lewis williams jessica would lewis williams jessica
15843230,convert and hl-seven segment xml have xml that being able generate use hapi library and use xsl change the format the xml use the following template the current template look the obx segment for digital value and then interpret the obx6 units measure however trying interpret the obx6 when they come from one the clients style duplicates with the caret between current template ignore this but would like able get the value the segment substr before after the the result produce from thank advance
54313746,what bracket and brace mean hl-seven segments work project that involve hl-seven message read the documentation understand what the different kind segment mean come across three different kinds syntax when look the document they being below what the difference between segment without any sort braces brackets segment with both brace and bracket and segment with just brackets assume segment with bracket may some sort array list but haven able find anything confirming this
8585400,hl-seven specifically require soap hl-seven specifically require soap its web service protocol hl-seven compliant the transport protocol implement with rest hl-seven accept rest the transport protocol now the future realise that rest architecture satisfied with diverse number standards rest mean transporting xml schema format information over established rest please note before you being trigger happy close this question please read hl-seven similar asking question programming token ring carry ethernet
10764489,how import hl-seven for blood result and parse for patient report develop medical application use and asp net wherein need make module for patient blood result that module need import hl-seven message and then parse them get patient blood result and highlight normal value for that blood test have some dll from nhapi but know how use them can someone advise how start this module actual requirement being bloodresult ultimately this will import from hl-seven initially cut and paste results being parsed and processed show current result and highlight trend and abnormal value store results table
39022687,validate timestamp hl-seven schema see the and data types the default schema but doesn appear that validate the format this possible had instance recently where customer send timestamp with miss digit for validate this with the schema edit adding some clarification hopefully use and when adt comes pass through validator with the extension default this similar depending the version look like the code above want know put regex there somehow either the segment structure definition smpl the data type definition
34436013,creat multiple versions hl-seven message within single application use hapi new hl-seven and hapi read hapi tutorial figure how support parsing multiple versions hl-seven single application however not sure how support multiple hl-seven versions while creat new message use package and structure version and want construct hl-seven message version how can that with hapi
40268902,order stu version fhir advanced directive dstu2 there order object which going use for document advanced directives don see this the next version any advice how model advanced directives order make the next version thank
39662803,use mllp release with hl-seven version documentations find web say mllp release requirement for all message transport protocols use transport hl-seven version content seem that mllp release used mostly with hl-seven version should use mllp release transport protocol transport hl-seven version why mllp requirement transport hl-seven version content
22174674,hl-seven v2x and data model the company work for start new initiative hl-seven where trade both v2x and cda specifically message the point where able accept validate and acknowledge the message receiv from our trading partner and started create data model for the backend storage said message after lot consideration and research loss for the best way approach this sql server currently idea load the data into data warehouse directly from integration engine biztalk and foregoing backing normalized operational database set the database for v2x message accord the spec all versions hl-seven being backward compatible store any previous version the same database initial design have table for each segment which tie header table with guid generate and storing run time the biggest issue with this approach the amount columns each table and something experience with for instance the pv1 segment have columns order accommodate all possible data addition this need make all columns varchar and make them big enough house any possible customization scenario from our vendor planning use varchar achieve this lot these columns the majority probably null use sparse columns this scream bad design but fully normalize these table require ton work both biztalk and sql server and not sure what gain from doing try pragmatic since have deadline fully normalized create stored proc that have ton parameters split these message the nth degree individual load into the smaller subtable and make sure they all correlate back the original guid want maintain acid process which get tricky and cause lot overhead biztalk suppose 3rd option use nhapi create objects out the message tie into with entity framework but nhapi seem like dead project and experience with entity framework right now basically loss and need help from some industry professionals who experience with hl-seven data model worth the extra effort fully normalize the table performance the sql side abysmal use these denormalized segment tables with hundreds column most which null for each row dba trying understand the pitfall each approach looked rimbaa but the hl-seven rim seem like foreign language hl-seven newbie and translating message the rim take far longer than have complete this project hope overthinking this and there simpler solution star the face hopefully this question isn too open ende
22506180,difference between hl-seven ver and googled this title but unable find any comprehensive information chiefly interest new segment that been introduce version
25261705,difference between hl-seven ver and google unable find any comprehensive information which being the new segment are adde version like validation message
29734229,oru version and get repetition from field maximum repetition only rep segment obx rep field get this error while pars the message throws exception this line error get repetition from field maximum repetition only rep segment obx rep field sample message
11893969,read sqlserver database use mirth connect and convert into xml format and vice versa have requirement where read data from sql server local database and first map xml file provided another third party org who have their own database then have proper mapping field have transform the data from sql server database xml format and vice versa far able connect sqlserver database mirthconnect however know what steps are required create channel and transformer carry the task read data and mapping correspond fields xml format provide third party and finally write xml file provided and vice versa short get detail creating channel mirth connect where read sql server database and map the fields correspond xml file guess write same way apply from xml format sqlserver database can someone tell how accomplish this for database field map what the best way map field entirely two different database there any tool which help once the task transform the data from one end another accomplished there any way validation mirth connect that verify that data correctly move from one another
39619046,lxml xsi schemalocation namespace uri validation issue trying use reproduce the cda example find the particular running into issues with namespace trying recreate this element the code using follows the problem with the entry appears trying validate the value and give the error specify the value incorrectly there force accept any string value the value the example simply intend placeholder that supposed replace with something else
32526544,e4x json conversion fail for duplicate xml elements kindly see below code using convert mirth xml json concern here additionalmessageinformation elemt use two time function fails create json kindly help anyone convert xml json usingg javascript code not any api
1050644,convert xml plain text goal build engine that take the latest hl-seven cda documents and make them backward compatible with hl-seven which radically different beast the cda document xml file which when paire with its matching xsl file renders html document fit for display the end user hl-seven need get the rendered text devoid any markup and fold into text stream similar that write out character lines populate the hl-seven message far taking approach using xslcompiledtransform transform xml document use xslt and product resultant html document next step take that document perhaps step before this and render the html text search for while but figure how accomplish this hope its something easy that just overlooking just find the magical search term can anyone offer some help fwiw read the other question which embrace admonish using regex for this and don think that want down that road need the rendered text
15212599,there error xml document endelement invalid xmlnodetype when deserializing consider net client calling into remote xml soap web service that define web reference the client calls the service and attempting deserialize the return xml into object the web method execute properly and the xml returne from the service well formed confirm fiddler the web service know good working service have another client net consum without issue when the net web service proxy classes attempt deserialize the returned xml this error thrown the line column the that complain about the how resolve this issue with net deserialization attempt solution with resolution more information move from net hoping see any fix the newest
23540152,transform hl-seven xml use apache camel routes new hl-seven convert the hl-seven xml use apache camel routes extract the hl-seven message from file can any one help how convert hl-seven xml
5303623,convert xml hl-seven message use mirth connect work with mirth connect and getting stuck one task transformation xml hl-seven connect access database the hospital system access set the channel and set the connector type file writer the destination tab when deploy the channel see the log file populated with the records xml format now stick how convert transform the xml message hl-seven any pointer out there
6182611,and determine if 86 or 458 is within that numeric range xsl take range value like and determine within that numeric range pars xml file like xls stylesheet need display value indicating whether the value within the normalrange below above this very common problem when display human readable result from the ccr continuity care record healthcare hl-seven message xml document
35036276,reversible mapping between fhir and archetype possible trying understand the risk involve one system speak fhir and another speak openehr archetypes especially for the observation questionnaire device and patient resource can the two content formats mapped between each other seamlessly utilize some extension where require what being the major issue such map and being there people organisations vendor who have done such mapping
41891872,relationship between fhir and openehr new openehr and health informatics general space but find myself stick with this question how hl-seven fhir and openehr relate understand that hl-seven etc basic messaging for interoperability but fhir seems add some clinical data model this the form resource visit with patient with observation mind clinical model and when you add fhir server concept verge the cdr then openehr model the same clinical concept through archetype aggregate within template fantastic this think get and see where fits openehr next where the cross over interoperability openehr designed provide archetype direct map the model the screen understanding datasource and interoperbility you will its simplest form client calls server server run aql the data and return xml result client runs xsl over that generate html but isnt fhir more about interoperability and openehr about data modell now suggest openehr server serve the result openehr standard and try map fhir resource and serve the front end any interoperable system looking pick one and forget the other there lot this but say very confused thank
45031844,mllp connection going create new spring boot application fetch hl-seven message and process some case need use mllp protocol for data transfer implement the same java what the advantage use mllp
4598296,hl-seven interface engine recommendations some consulting work for small pharmacy services provider that need hl-seven interface engine setup for provide interfacing product that run the lamp stack more specifically what look for hl-seven engine that run nix and insert data from hl-seven message into mysql database the data that inserted data taken out arbitrary field needs parsing tried using mirth but its ability make any seemingly simple task overly complex and the extreme slowness its client interface response times make very gun shy when state simple task mean like send custom ack message based upon few rules forces write lines javascript and after that still get horrible response times love iguana and wanted use but they quote between 12k and 15k for single instance single server good piece software but not that good justify price tag like that well that well beyond what customer willing pay for single piece software that drive small part their business anybody have any recommendation for open source and proprietary software that meet these need
6601712,what msg mean mirth trying learn way around some mirth code keep seeing thing like this the transformer for different channel understand that this pars hl-seven message and understand that msg means message but system wide variable every channel have variable what the scope also keep seeing thing like the template certain connector types automatically send the content
38400543,invok mirth connect cli with powershell script use powershell invoke the mccommand exe explicitly avoiding use the parameter the mirth cli pass mirth script file because want pass dynamic command instead the mirth shell when invoke mccommand exe from interactive powershell console able connect the mirth connect server and the opened where run one more mirth shell commands manage mirth channels example when run the same command from within powershell script via the windows powershell ise get the same connected mirth connect server message but the script wait and get the command prompt that allows pass mirth shell command mirth any thought how route commands the mirth shell via powershell script
45617164,mirth connect stop message propagation through destination use mirth connect have database reader source connector and javascript writer destination connector decided put some fancy code the destination four separate thing which follow one after the other basically write the code and seeme that too long and too clumsy decided split into destination that daisy chained via the wait for previous destination option the question how interrupt this chain execution error occur one the destination find jira issue from say that actually the error that occur the body the destination connector prevent the message from all other destination and state that the version behavior still current error that occur the destination transformer stop the message from propagating tried throwing error both the destination body and destination response transformer and both cases the message continue other destination also tried returning responsefactory geterrorresponse from the destination body with luck also tried setting responsestatus error destination response transformer avail they mean the normal transformer filter also maybe particular solution split task into distinct destinations the reason why the destination were create the first place think that the documentation states that destinations are basically what the actual word destination stand for the above case true maybe there being better way organize the code functionally mirth think including external file allow javascript writer even were prefer everything sit inside the channel itself and exportable importable single file thank you
58842520,read library from cdn within mirth some test around mirth connect test channel that the datatype being for the source and one destination the destination anything right now the source the connector type and the code the following the error get the reason want this build custom internal library with unit test and serve them with internal company cdn and allow mirth consume them how make the library available mirth
7717612,how display list the contents the mirth globalmap object there method function available mirth connect that list output the contents the global map would like both the key and the value the key
15081723,mirth java code conditionally change field use mirth read hl-seven message from our and send them out client emr this particular emr require that the obr and obx for the embedded pdf are format specific way obr and obr have 0pdf pdf report need insert pdfreport pdf base64 into obx obx and obx shown the example below the code using works the time but seems break specific report type especially when there being more obr than obx any help resolve this issue appreciate the code use below
53584035,how check attribute from xml tag undefine javascript mirth connect want check attribute xml tag present not here the sample xml tag want check following conditions tag present code present code null currently check condition below but this condition return hasvalue flag always true even code missing undefined there way check code undefined missing
28703112,multiple nte segments hl-seven message with mirth trying add multiple nte line the end hl-seven message use mirth add single line use example but when want add line below that use the tmp msg because will simply overwrite the previous line the end trying add something like this the end the message the content static just need understand how create each line separately
2799643,how this method give error this application using call mirth but appears com from inside apache commons library from method that check something indeed base64 encode all the doc say the only return true false how get
44307730,java heap size error mirth use mirth connect and have xml file which almost 85mb size and contain some device information need read this xml file and insert that data the database sql server the problem face when try read the data show java heap size error increase server memory 1024mb and client memory 1024mb but show the same error increase the memory more not able start mirth connect any suggestion appreciated thanks
3353401,how get hl-seven template for mirth connect new this hl-seven standard but earlier work ncpdp standard now try explore mirth connect open source tool when trying configure per the documentation user guide which provide url but this documentation mention use hl-seven template don where get these template can you please help searched internet and some where forum found following example template msh mirth domain labtest date get yyyymmddhhmm adt uuid evn date get yyyymmddhhmm pid patno family name first name middle name sex address1 address2 address3 phone emp phone marital status religion pv1 when use this and try run the channel getting follow exception events and server log please help resolving this issue thank student
29607586,why this string javax sql rowset serial serialclob being include output file instead the actual value use mirth extract data from sql server database and write the resultset flat file the code work prior new column being adde here the code transformer script for mirth channel destination the file out the last column being populate the actual value but the following string copay javax sql rowset serial serialclob 1b795929 javax sql rowset serial serialclob 5693cfb7 below the sql for the last column
20907536,how send message hl-seven mirth http connector using post have mirth instance version sending using post method web api restfull service the problem that the message hl-seven that send the service outbound message cut the first character for example the message msh cpsi iso cgh the receivedmessage variable the text msh receive only how order that the message cut the http channel the configuration post query parameters headers content type content type value and the value that send
2435563,mirth transformer error prefix for element bound getting the following error when trying convert hl-seven hl-seven the message pass the error get when remove the tag front the envelope and body and redefine the namespace default give new error this referr mirth handle the namespace being define the same line the first use that element any suggestion would useful
23347744,mirth connect fails evaluate transformer work with mirth connect and getting stuck one task transformation xml hl-seven use xml template dragging and dropping values the hl-seven template destination method file directory throw axsflw file name message encodeddata the transformer message segment tmp pid pid pid mapping msg day patient lastname tostring message segment tmp pid pid pid mapping msg day patient firstname tostr when the source get xml file mirth connect fail with this error hope somebody point solution this seemed work mirth connect thank for any help
39573089,mirth database reader how deal with multiple row returne from sql query new mirth connect and need some help working demo like the following the source database reader the destination document writer the sql select query the source return multiple row and this what need trying generate pdf document the document writer which contain the value all returne column but actually what write the file the last returned row only this the html template wrote and the destination have transformers type map which maps the value the returned columns string the sql statement select two column from database both being string the first column represent path and the second column represents file name have many file name returne from the sql statement and need write all them this document any hint about how deal with every row returne from the query best regard
57098104,mirth how handle response when have multiple destination create channel with destination each one the destination have different response and decide use filtering message source example sending message destination filtered return response destination sent return response want source response response but not example sending message destination sent return response destination filtered return response want source response response but not how set source response match sent destination tried set source settings response each the mirth drop down option with success
19675123,how skip the header while processing message mirth use mirth having file having thousands records the txt file having liner header skip this header how can this suppose use batch file option thank
19922858,mirth send file like pdf zip transfer pdf files use mirth want transfer pdf zip file through mirh using file reader connector source and file writer destination connector can any one help how send transfer pdf zip file
50821378,how convert local date utc mirth mirth receive local datetime string which need convert utc soon found using the classic doesn work well this for give after some more searching found can this and from here stick don know how convert this utc local server timezone assume which enough for now but the future also need set specific non local timezone tried get the method use with but that give the helpfull also tried looking the java docs for dateutil and try some method from that but nothing worked does anybody know how convert datestring from local time utc all tip being welcome
9636427,what template message encodeddata mean mirth trying learn mirth system with channel that pull from database for its source and output hl-seven message for its destination the sql query pull the correct data from the source but mirth output all the data the right spots the hl-seven message the destination show that outputting template message encodeddata what that mean where see the template that use the destinations don have any filters transformers confused
