id,text
21616547,database design for dentist app web app for sister she recently receive her degree odontology having bit struggle with the database design though obviously supposed have appointment table tbl appointment appointments have treatment associate them and those treatment all have different attributes columns thinking have tbl appointment and also tbl treatment not sure how link those table have multiple treatment types with different treatment parameters and save the treatment data relate the appointment what you think would good approach this already have something draw out but definitely doesn seem good end have one table for each treatment type and don think that the best solution edit this wasn clear enough here screenshot how actual look like implement the treatment the periodontogram end with table one for each treatment type want avoid that edit ian kenney get what you suggest right this how the portion the database discussing look like right don pay attention the relation types they all aware use some there but just for the example
12182364,exchange hl-seven message over the internet new using hl-seven currently exchange hl-seven message over tcp with standard hl-seven tcp listener sender this all work fine and doesn pose any problem but host emr create and maintain vpn our server this question this there way that bypass the vpn and exchange hl-seven message over the internet https and from our web services search and search but find any answer one way another and please nothing about hl-seven version because nobody actually seems use customer being all using hl-seven versions have for year and show inclination change
48108329,problem with send data hl-seven server use node just trying make simple hl-seven mllp client using node make some code that create connection with hl-seven server via socket send some data server then wait for some answer for test purpos use hapi testpanel issue when send data use script hapi testpanel testpanel don anwser the testpanel log says that client connect and than nothing when turne debug option testpanel log says that testpanel recieved bytes from client end then nothing else what the wrong with script can anyone help thank you here script here screenshot testpanel log
4304998,when close and reopen socket after hl-seven message sent trying open basic connection hl-seven server where send request and get the ack response this will done continuously this done continuously when close the socket implement this correctly this case close the socket how open again the javadoc for connectionhub indicate the following however real life will open new connection was close result the first pass perfectly with request sent and ack receive any subsequent call this method results the client side remove the call then run fine for certain amount time then the socket close itself
9432876,jax java client wcf service interoperability bad request ask this question the try connect wcf service use the open source health care integration engine mirth mirth java based uses mule internally which use jax the wcf server return http status code bad request don have easy access the wcf server communication with the client works well visual studio add service reference and then main the autogenerated wcf client from the wsdl have app config with endpoint and this bind the only thing done differently the wcf solution extend the maxnametablecharcount and maxarraylength the readerquotas tag for the binding question the rest leave with default value however found set these mirth should this indeed the reason for the error run mirth most recent checkout and the mirth channel set both read and send hl-seven document the problem arise only when trying communicate with the wcf service the destination web service sender with both service and port read from the wsdl there authenthication and the envelope generate from the only available operation use mtom fairly certain that this relate jax and wcf interoperability any general hint tried setting properties jax connection deep the bowels mirth tried setting the http chunk size dispatch getrequestcontext put jaxwsproperties http client streaming chunk size webservicemessagedispatcher java line the stack trace follow
32068133,post xml json fhir api server work medical application base hl-seven fhir trying add new record use xml and json both but all get the internal server error the xml trying post posting this xml api server use php curl but get internal server error try with json too but luck here the json spent days fix this issue but couldn find any solution any help appreciated thanks
11148553,response send from tcp listener create simple tcp listener handle hl-seven message receiv the message correctly and attempting send ack message back the server the other end doesn seem getting the response though you see anything wrong with this set realize needs refactored little right now just trying establish the connection
28031073,send http header from orbeon xform submission have api that depend certain http headers for specific behavior example http header post support updating version matches the value how send these http headers from orbeon xforms submission
15978335,how send mirth http connector using post have mirth instance sending using post method rest service however mirth seems send least one parameter through the url like get have the following option set method post multipart send response none response content header and body xml authentication use persistent queues charset encod utf then have query parameters one which the name file and value message rawdata watch the apache request log and see this attribute value pair come across the url doing get post header content type text plain content literal data use mirth connect server how force this value file come across the post
30208002,hl-seven servers and hl-seven listener develop web service that suppose get hl-seven file from client and parse into xml then push data into database now question what need focus for this requirement hear that usually emr system send hl-seven file through tcp how hl-seven server work need create hl-seven listener this hipaa compliance that hl-seven push server through tcp can any explain all
30405438,message response zombies occurr with errors code and orchestration consider the following message flow biztalk mllp receive ports locations setup receiv hl-seven message one application these port each receive slightly different message type let call this one rp1 another application send port that subscribe each respective receive port these send port each have outbound map that transform the message hl-seven and submit wcf request response service let call this sp1 the wcf service then process and validates the hl-seven and send hl-seven ack message the sp1 send port have custom send and receive pipeline components the receive from the wcf response just take the message and promote certain field which use later for subscription there being then two more send ports sp2 that subscribe positive acks sp3 the negative base the field promote above the positive acks are consume and the negative acks being emailed off support staff the issue that about message see these error message popping followed suspend service instance the group viewer the service name the suspended instance that rp1 the message type the non consumed message that the ack from sp1 the wcf response this weird because mind rp1 should expect this response message and there being send ports sp2 sp3 subscribed the response message type the other point forgot make there being receive port like rp1 each with receive location and send port subscribe their respective receive ports the biztalk server install across physical server shar biztalkmgmtdb messagebox previous this have the same number message feed but was consolidate the sending end one single receive location the old solution have multiple orchestration but experience this issue why now being the wcf hl-seven response message getting lost and being suspend under instance rp1 hl-seven here basic image what look like
27028131,there some fhir test server with continious integration http hl-seven fhir github release want make some proof with new resource commit there some available fhir server for testing thanks advance regard
9539792,ehr intercommunication client researching method for build client interface for exist emr read tons info hl-seven well the various cod scheme but still really clueless for anyone whose work with emr before possible build web interface that use http post and http get requests pull push data the server database would you have separate database for the client say web application then use some interface engine like mirth communicate between the emr database and the web application
24528536,request patient demographics from his via hl-seven work application that connect with his via the hl-seven protocol the connection for synce the patient demographics save application with the his how you request patient information some patient their anytime the documents talk about update trigger the patient demographics change his send the new data there way request the data anytime
40363249,hapi failing return basic resource after successful upload try upload resource hapi base the resource type basic and create custom profile and extension for the concept try capture uploade those structuredefinitions the server using host local host but not yet validate this upload against still trying test that the format use for xml correct uploade the following bundle there being many more record the actual bundle just edite down for clarity which seems uploade correctly since get the response however when try access this via the url get the following response any idea what cause this issue work fine when upload patients and try pull them back but try for basic seem work
13377837,pass property from insequence outsequence sending message with proxy hl-seven tcp port and get the response the outsequence but problem that all property set the insequence being anymore available all them being null tested with all the different scopes transport axis2 axis2 client but none them work the hl-seven sender destroy the property how use property from the insequence the outsequence example proxy get message from activemq jms and send hl-seven port use wso2 esb and install the hl-seven feature receiver use the 7edit application
11436102,disappear cookie mvc4 after creation httpmodule create module handle authentication microsoft healthvault the beginrequest event handler check for the authtoken and when received creating new cookie hold the user information for use later the controller lose the cookie but maybe look the wrong place the event handler take httpapplication the only parameter add the cookie application response cookies collection the question come down this instance httpapplication singleton the same system web httpcontext current applicationinstance perhaps though cooky set this point the lifecycle being later wipe that what wrong any help appreciated update changed few thing since pose the question now handle prerequesteventhandler httpmodule let healthvault webapplicationutilities object the cookie creation and storage though conceptually nothing changed having any trouble creat the cookie read the first time after create here cookie creation code the httpmodule event handler notice that the redirect comment the first request after auth the cookie create and default action able then read using loadpersoninfofromcookie find that the redirect cause the cookie send the client notice that the subsequent requests the cookie present the request cookies collection when loadpersoninfofromcookie runs end with null strangely see the cookie the response object but the content being empty here the action code just because update here the cookie from the immediate window even bumped the expires time days the default action right after create the action the next request interestingly the cookie define the response object but the value gone and the expires time reset
21085706,fetch data from cerner emr ehr don have much idea medical domain evaluate requirement from our client who use cerner emr system per the requirement need expose the cerner emr fetch some emr ehr data and display sharepoint portal meet this requirement what kind integration options cerner propose there any api web services expose which used build custom solutions for the same far know cerner expose emr ehr information hl-seven format but don have any idea how access that request cerner for the same awaiting reply from their end anybody who associate with similar kind job can through some light and provide with some insight
57614298,python hl-seven listener socket message acknowledgement trying create hl-seven listener python able receive the message through socket but not able send valid acknowledgement python code
37592522,hl-seven fhir better use restful api json adapt format database have restful api implementation fhir with json though can query just the same database haven use restful before would better adapt this json structure database and use the kind restful api they provide
24911293,java rest client for fhir data model anybody give example for java rest client search patient use fhir data model
51816213,restful api requests using trying get example find from this work and method work but have some issue with and get server reply bad request with get this error httprequestworker cpp changed request type here function for get contents json file from computer and execute the whole input request for the server here the simple json want upload json file should right because able and with postman and other tool there something obvious that miss capture from postman with see that read json successful have trying find solution for with success
40000311,fhir restful adding multiple patients resource single call the title says post patient resource fhir via multiple call and have the patient passed xml have hundreds thousands patient add well tons other data just wonder there more efficient way post this
40044494,how add profile via the fhir rest api hapi look the documentation for creat profile for fhir and use forge create some xml that believe valid describe profile find the documentation where actually state what request need make the restful api actually add new profile any idea
40349022,how convert hl-seven fhir like replace hl-seven transactions with fhir resource transactions and want know what the option being map fhir resource based researches through the doc and discussion there two potential option stand out map adt encounter with extension for children resource references model adt fhir messaging process with bundle several resource and linkage info what being your recommendation thank
3653811,icd code list xml csv database format look for complete list icd codes medical code for diseas and procedures format that can imported into database and referenced programmatically question exactly the same but the original poster neglected mention where exactly get ahold his complete list google definitely not friend here spend many hour google the problem and find many rich text type list such the cdc websites where drill down the complete list interactively but find where get the list that populate these website and parse into database believe the files here have what look for but the file being rich text format and contain lot garbage and format that would difficult remove accurately know this has been done others and trying avoid duplicating other peoples effort but just find xml csv excel list
1520257,look for resource for icd codes been ask client incorporate icd codes into system looking resource get complete listing code and description that end sql database unfortunately web service out the question fair amount the time folks will off line using the application find and but neither offer download export the data that find found which have database the icd codes but they being the correct format and not sure how properly convert shows the code which really but find rule how when convert the code include decimal tagging this with medical and data since not sure where tag any help there appreciate
46574108,convert icd9 codes keep just the top result when there being multiple trying convert icd9 codes icd10 codes some the conversion have multiple result just want keep the top result and place into new column have dataframe named test and the function convicd from the package icdcoder throws error since some conversion have more than one result for code convert two different value just want create new column test test icd10 which have the first result from each version for example when converts convert sure there really simple solution for this but think
34276529,look for icd10 api any body know good icd10 api diagnostic code lookups that recommend build simple app tag patients with medical condition and the idea have lookup api where one type asthma for example and get all the different icd10 codes for asthma
37915693,drug and icd lookup web service for web app want lookup drugs name and icd codes keyword code web portal user enter keyword and select from auto complete list portal try the but seem get the icd work doesn support lookup keyword this query doesn return any record this example trying look for icd code how achieve this any help appreciated
30064437,neo4j cypher unidirectional query when there being bidirectional relationships don think possible what seek but think throw out for creative suggestions the unified medical language system umls semantic ontology which have variety bidirectional relationship between node for example isa and inverse isa the problem there being many such name and their reverse direct relationship thus query enough exclude one because the listing have many possibility which cumbersome and may overlook something the problem other word can you create directed acyclic graph query when there being relationship that reverse the traversal you have outbound relationship from node you want ignore the inbound relationship from use neo4j the umls filter the data have 11m node and 45m relationship there being relationship types and the list dynamically grow this another reason for generic solution not dependent specific listing and out bind relationship
31033112,parse xml doc clinical document architecture cda hl-seven standard using everest framework try parse some clinical information from xml file that standardized hl-seven cda standard xml file what the best library this find that everest framework grate for such kind work but find any example how achieve this anybody use this framework before look example where deserialize this xml file into clinicaldocument class thank
777933,hl-seven object model for net search for library framework that provide object model parsing validate etc the idea would able spin new object type hl-seven then call message type oru adt orm wouldn life great being able something like this
33113263,split single column into multiple observation using work hcup data and this has range values one single column that needs split into multiple column below the hcup data frame for reference the desired output approach this problem use the package splitstackshape and use this code this approach lead memory issue there better approach this problem some comments the data have many letter apart from the letter can either the front the very end but not between two number there change letter from one single range
33156991,how integrate any dplyr working claims data which look like the below format would like group mem number and year month and covert all those labels clinics even single label that group clinic the output approach this problem its giving errors know mistake and how resolve
39126019,transform collections strings rdd try parse hl-seven value for that use few jar file those jar file parse hl-seven value from string execute the code and work fine scala but now want the same thing run scala for that use below code with the sample but get the below error solve the issue want convert code update sample error
41616446,iterate over paged fhir response run query hapi fhir database which returne paged result back using hapi base java actually the search per the documentation here the code run far getting the first bundle and print the url expected however when tries execute the next bundle get connectionexception connection refuse connect the server still appear responsive however rerun program and have the exact same result returne any idea why the connection being refused get similar issue when try run manually from postman
17062758,hapi version msh filed concerns using hapi release version and work perfectly but issue with error response that get from hapi request and response the above response you check the msh field ack ack shouldn that ack because additionally message that field which not valid and suspect that pick that from the original request anybody help this how avoid that invalid segment why hapi additionally add that field the msh field
7081256,which jvm base language use for map one type another currently work with java write program that eai between two application one application come with hl-seven which parse with hapi get java object structure want transform this structure own structure that want use generate xml file with jaxb after some other work opinion current solution not very nice because the source code get very complex which language appropiate language such type mapping think java not the best language for that don have much time for learning need language that easy learn and which have low begin learn peek already have some experience the functional languages haskell and first think groovy would good language but then find other opinion that suggest scala which language would you suggest for doing type mapping
23247476,serialise fhir resource json using net api use the fhir net api attempt parse xml file and then serialise json the first line work fine and see that the xml file the bundle parsed and the inputbundle object however when then serialise json the second line code get error for info the xml file using taken directly from any idea what wrong
33041824,select date from previous observation and input into new column work patient health records and trying find the last clinic visit from there first clinic visit below the data frame the output planning use the dplyr approach need some guidance the mutate part
34752076,ifelse within dplyr take longer time execute working medical claims data and the data file showcased below create new column flag which group claim and the status for the same claim include both and the flag column include approach this solution use dplyr this approach take longer time and also mark all the row yes flag column
21964779,tag string after each digit number string from hl-seven message lab results and need add line break after each digit number example string the digit string date and timestamp this change every test
36031607,detect astm protocol end transmission working implement software for connect analyzer and receive lab data faced problem how detect the end transmission between the analyzer and software the program receive the data correctly but faced problem how detect the end transmission when the analyzer finish sending data send other server the communication specification for astm e1381 section mention that the etx character the indication for the end text and eot character the indicator the end transmission program check the received byte check the character etx eot close the socket and use the data also check the received equal eof for unknown reason the analyzer send any these characters etx and eot there any method detect that the analyzer end the transmission data follow simple code for accept connection from the analyzer
57520228,populate array use loop attempt parse pipe delimited line text from file hl-seven message segment make the segment property hl-seven message object think understanding the concept dimensional arrays the segment look like this want create array thusly first item the array msh next item the array next item the array null next item the array x530 fid get error message
17116424,the character hexadecimal value include name use vs2010 net and xmlwriter create xml documents hl-seven cat specification there attribute sdtc valueset that create the document unable write this attribute name due invalid character here the actual line code anyone have solution for creat the attribute shown continu research but decided post this question hopes find solution this question flagged duplicate arguing existing responses referenced write element use linq the problem explicitly states attribute using xmlwriter one responder suggested using overloaded writeattributestring method which solved the problem
26026324,how mask specific elements hl-seven currently learn how work with hl-seven and how parse python now wonder what happens value hl-seven segment contain pipe sign how this sign handle there masking lead crash the hl-seven parser there mask possibility
20219223,extract image from hl-seven files given hl-seven file which know that its txa segment there byte code image how extract that image know question blurry but that the detail edit the txa segment follows thank advance
35597335,hl-seven organization identifier urn oid need transform hl-seven organization identifier root extension urn organization follow fas know use urn oid but how add extension value thanks
